id,sloka,translation
905,nīrajātaśca bhagavānsomo grahagaṇeśvaraḥ| amṛtaṃ ca sudhā caiva svāhā caiva svadhā tathā|| annauṣadhyo mahārāja vīrudhaśca jalodbhavāḥ| yataḥ prāṇabhṛtāṃ prāṇāḥ sambhavanti viśāmpate|| devānāmamṛtaṃ hyannaṃ nāgānāṃ ca sudhā tathā| pitṝṇāṃ ca svadhā proktā paśūnāṃ cāpi vīrudhaḥ||,"The Blessed One, Soma, has indeed been born as the lord of the assembly of planets. The immortal nectar and the honey, as well as svaha and svadha, have also come into existence. O King, the life-sustainers of all living beings arise from the herbal and watery substances born in this way. For the gods, it is the nectar, while for the serpents, it is honey. The offering to the ancestors is called svadha, and that for the animals is the herbal substance."
906,tasmādvā etasmādātmana ākāśaḥ saṃbhūtaḥ | ākāśādvāyuḥ | vāyoragniḥ | agnerāpaḥ | adbhyaḥ pṛthivī | pṛthivyā oṣadhayaḥ | oṣadhībhyo'nnam | annātpuruṣaḥ |,"Therefore, from this self, space has arisen; from space, air; from air, fire; from fire, water; from water, the earth; from earth, plants; from plants, food; from food, the person."
907,sa vā eṣa puruṣo'nnarasamayaḥ | tasyedameva śiraḥ | ayaṃ dakṣiṇaḥ pakṣaḥ | ayamuttaraḥ pakṣaḥ | ayamātmā | idaṃ pucchaṃ pratiṣṭhā | tadapyeṣa śloko bhavati ||,"Indeed, this person, the supreme being, is infused with essential qualities. This very thing is its crown. This one here is its right wing. The other one is its left wing. And this is its self and the support of its tail feathers. Even this verse speaks of it."
908,ahamasmi prathamajā ṛtasya | pūrvaṃ devebhyo amṛtasya nābhiḥ | yo mā dadāti sa ideva mā''vāḥ | ahamannamannamadantamadmi |,"I am the first-born of the eternal law, born before the gods from its source. The one who gives (me) is indeed the imperishable. I consume everything as the eater of food and the consumer."
909,annaṃ prāṇamannamapānamāhuḥ | annaṃ mṛtyuṃ tamu jīvātumāhuḥ | annaṃ brahmāṇo jarasaṃ vadanti | annamāhuḥ prajananaṃ prajānām |,"They call it food, life-breath, and water; they say that food enables one to overcome death and sustain life. The learned ones proclaim it as the very embodiment of Brahman, the cause of procreation for living beings."
910,bhojayecchvabhyaḥ śvapacebhyaśca vayobhyaścāvapedbhūmāviti nānavattamaśnīyānnaiko na pūrvaṃ | tadapyetadṛcoktaṃ moghamannaṃ vindate apracetā iti,"One should offer hospitality to dogs, crows, and young ones, not partaking of their share first, nor considering it the best. Even this has been declared in vain by those without knowledge."
911,moghamannaṃ vindate apracetāḥ satyaṃ bravīmi vadha itsa tasya | nāryamaṇaṃ puṣyati no sakhāyaṃ kevalāgho bhavati kevalādī ||,"The unintelligent one attains (vindate) worthless food, I declare (bravimi) the truth (satyam); his (tasya) slaughter (vadha itsa) is certain; he does not (na) prosper (pusyati) who treats him (aryamanam) as a friend (sakhyam), only harm (kevalagham) arises for him and others (ādi)."
912,abhyāgato jñātapūrvo hyajñāto'tithirucyate|,"The previously known guest is referred to as unknown, (while) the unfamiliar one is proclaimed as a guest."
913,apraṇodyo'tithiḥ sāyaṃ sūryoḍho gṛhamedhinā | kāle prāptastvakāle vā nāsyānaśnangṛhe vaset | |,"The sun, setting at the designated time, has been swallowed (by the horizon). Whether it is time's arrival or not, one should not stay away from eating food at home."
914,sarveṣvevājasrā agnayaḥ syuḥ agnipūjā ca nityā yathā gṛhamedhe āvasathe śrotriyāvarārdhyānatithīnvāsayet teṣāṃ yathāguṇamāvasathāḥ śayyānnapānaṃ ca videyam,"Let all fire rituals, performed with the reverence due to them and regularly as in the Gṛhamedha, be carried out by worthy priests using every kind of fire. In accordance with their respective qualities, proper accommodations, bedding, food, and drink should be provided for them."
915,abhṛtānāṃ bhavedbhartā bhṛtānāmanvavekṣakaḥ|,"Let him become the protector of the dispossessed and one who scrutinizes those who have been given (i.e., their worthiness)."
916,saṃvibhāgo hi bhūtānāṃ sarveṣāmeva dṛśyate| tathaivāpacamānebhyaḥ pradeyaṃ gṛhamedhinā||,"The distribution of all beings is indeed observed, and similarly, what should be given to those who have come to beg is determined by the householder."
917,dadasvānnaṃ dadasvānnaṃ dadasvānnaṃ yudhiṣṭhira ||,"Engage your forces in the battle, O Yudhishthira, with (the help of) horses, chariots, and elephants."
918,yanna prāpyaṃ tadaprāpyaṃ vidyayā pauruṣeṇa vā | satyo lokapravādo'yaṃ nādattamupatiṣṭhati ||,"""Without attaining which, and being unable to attain it, even through knowledge and effort, this is the proclaimed truth: it does not establish itself."""
919,annaṃ dehi sadā rājan sarvakālasukhāvaham || annena caiva dattena kiṃ na dattaṃ mahītale |||| sarveṣāmeva dānānāmannadānaṃ viśiṣyate || annādbhavanti bhūtāni annenaiva ca varddhate ||||,"O king, always give food (to others), for what is there that is not given through this act on earth? Of all forms of giving, the gift of food is the most excellent. Through food, beings arise and grow in this world."
920,na kañcana vasatau pratyācakṣīta | tadvratam | tasmādyayā kayā ca vidhayā bahvannaṃ prāpnuyāt | arādhyasmā annamityācakṣate | | edadvā antato'nna~rāddham | antato'smā anna~rādhyate || ||,"None whatsoever should be shown special treatment in their abodes, such is the rule. Therefore, one does not obtain great wealth by merely wishing for it through any means or actions. This (the food) is declared to be inedible (for the Brahmin) before being offered, and is made edible (offered) only afterwards."
921,na tasmātparamaṃ dānaṃ kiñcidastīti me manaḥ| annātprāṇabhṛtastāta pravardhante hi sarvaśaḥ|| tasmādannaṃ paraṃ loke sarvalokeṣu kathyate| annādbalaṃ ca tejaśca prāṇināṃ vardhate sadā||,"""From this, there is nothing superior to giving (dānam) in my opinion. Indeed, all things increase from food (annāt). Therefore, food is called the foremost in the world. From it, strength and radiance increase continuously in living beings."""
922,annena dhāryate sarvaṃ jagadetaccarācaram| annātprabhavati prāṇaḥ pratyakṣaṃ nāsti saṃśayaḥ||,"By this , the entire world, moving and non-moving, is sustained; from this arises the vital breath ; without a doubt , it is the visible that is born from it ."
923,āyurvedo dhanurvedo gāndharvaścaiva te trayaḥ | arthaśāstra caturthantu vidyā hmaṣṭādaśaiva tāḥ || ||,"The three are Ayurveda, Dhanurveda, and Gandharva, and the fourth is Artha-shastra; indeed, these eighteen constitute knowledge."
924,iha khalvāyurvedaṃ nāmopāṅgamatharvavedasyānutpādyaivaprajāḥ ślokaśata sahasramadhyāyasahasraṃ ca kṛtavān svayambhūḥ tato'lpāyuṣṭvamalpamedha stvaṃ cālokya narāṇāṃ bhūyo'ṣṭadhā praṇītavān vidhātātharvvasarvasvamāyurvedaṃ prakāśayan| svanāmnā saṃhitāṃ cakre lakṣaślokamayīmṛjum” iti bhāvaprakāśokteḥ |,"In this world, the self-existent creator, after having created the science of life (Ayurveda) consisting of thousand shloka and thousand chapters, himself studied it completely. Seeing that even those with short lives and few sacrifices are still able to achieve great things through its knowledge, he made it widely available to people. Thus, revealing Ayurveda as the ultimate science of life, he also created a collection of hundred thousand verses named after himself. This is the explanation of the statement of purpose."
925,caraṇavyūhamate ṛgvedasyopavedaḥ āyurvedaḥ,"The secondary Vedas, Rigveda's explanation and Ayurveda, have been systematically set forth (in written form)."
926,kimicchantī saramā predamānaḍdūre hyadhvā jaguriḥ parācaiḥ | kāsmehitiḥ kā paritakmyāsītkathaṃ rasāyā ataraḥ payāṃsi ||,"What does Sarama desire, standing so near and barking at those over there? Who indeed is she, and who was the one who enclosed her? How did this happen with rasayā? You (sing.) poured water."
927,kīdṛṅṅindraḥ sarame kā dṛśīkā yasyedaṃ dūtīrasaraḥ parākāt | ā ca gacchānmitramenā dadhāmāthā gavāṃ gopatirno bhavāti || nāhaṃ taṃ veda dabhyaṃ dabhatsa yasyedaṃ dūtīrasaraṃ parākāt | na taṃ gūhanti sravato gabhīrā hatā indreṇa paṇayaḥ śayadhve ||,"Who are these two, Indra, to whom this message comes from afar? And who are the friends that he goes to, embracing them, becoming their protector? I do not know him, the one to whom this message comes, nor does he keep himself hidden from those who have sharp hearing. Those fierce and mighty ones, struck down by Indra, do not hide themselves. ""You all become manifest!"" - such is the command given to them."
928,imā gāvaḥ sarame yā aicchaḥ pari divo antānsubhage patantī | kasta enā ava sṛjādayudhvyutāsmākamāyudhā santi tigmā || asenyā vaḥ paṇayo vacāṃsyaniṣavyāstanvaḥ santu pāpīḥ | adhṛṣṭo va etavā astu panthā bṛhaspatirva ubhayā na mṛl̤āt ||,"You, cows, what is this desire for yours that falls toward the sky from"
929,ayaṃ nidhiḥ sarame adribudhno gobhiraśvebhirvasubhirnyṛṣṭaḥ | rakṣanti taṃ paṇayo ye sugopā reku padamalakamā jagantha || eha gamannṛṣayaḥ somaśitā ayāsyo aṅgiraso navagvāḥ | ta etamūrvaṃ vi bhajanta gonāmathaitadvacaḥ paṇayo vamannit || evā ca tvaṃ sarama ājagantha prabādhitā sahasā daivyena | svasāraṃ tvā kṛṇavai mā punargā apa te gavāṃ subhage bhajāma || nāhaṃ veda bhrātṛtvaṃ no svasṛtvamindro viduraṅgirasaśca ghorāḥ | gokāmā me acchadayanyadāyamapāta ita paṇayo varīyaḥ || dūramita paṇayo varīya udgāvo yantu minatīrṛtena | bṛhaspatiryā avindannigūl̤hāḥ somo grāvāṇa ṛṣayaśca viprāḥ ||,"This treasure, Sarame, protected by the mighty Adribudhna and the divine cows, is guarded by the Paṇayas. Those pure and renowned Paṇayas, sugopā and reku, protect this padala-mā at Jagantha. 

Eha, come now, to this protected place, where Somashita, Aṅgirasa, and other noble Rishis have enjoyed in the past. Let us also partake of this ūrva today. 

And so, you too, Sarama, having been suddenly struck down by a divine force, serve this svasāra well, lest these auspicious cows abandon you again. I do not know if there is any relation between us, whether as brother or sister, but the ghorā rasas of Indra and Angirasa have hidden it away. 

May the worthy Paṇayas stay far away, summoned by this mantra, as Bṛhaspati, Soma, Grāvāna Rishis, and other viprās fail to find the truth."
930,asurāḥ paṇayo nāma rasāpāranivāsinaḥ | piveyaṃ tu payastāsāṃ gavāṃ yāstā niguhatha | asurāstāṃ tathetyuktvā tadājahuḥ payastataḥ sā svabhāvācca laulyācca pātvā tat paya āsuram |,"The wicked brewers, named Asuras and residing near the liquor, have declared those who partake in their brewed beverage to be of demonic nature, driven by desire and habit. You (pl.) should abandon that contaminated liquid."
931,tāṃ jaghāna tadā kruddha udgirantau payastataḥ jagāma sā bhayodvignā punareva paṇān prati,"Then, enraged, he struck her and set off, she having been filled with fear, while the pananas (cows) went back in the opposite direction."
932,atha ha vai paṇayo nāmāsurā devānāṃ gorakṣā āsuḥ| tābhir ahāpātasthuḥ| tā ha rasāyāṃ nirudhya valenāpidadhuḥ| te devā aliklavam ūcus suparṇemā no gā anviccheti| te saramām abruvan sarama imā nas tvaṃ gā anviccheti|,"Once, the panis named asuras were in charge of protecting the cows of the devas. They hid those cows in a secret place and fastened them there. Then, they offered that place to the serpent Vasuki. When the devas realized this, they urged Suparna to help them saying ""Please retrieve our cows."" Later on, Sarame addressed Sarama saying ""You go and search for our cows."""
933,aitareyabrāhmaṇe'sti kāṇḍamāraṇyakābhidham | araṇya aiva pāṭhyatvādāraṇyakamitīryate || satraprakaraṇe'nuktiraraṇyādhyayanāya hi | mahāvratasya tasyātra hautra karma vivicyate ||,"In the Brāhmaṇa of the Aitareya, what is designated as the Āraṇyaka exists. The Āraṇyaka should indeed be studied in the forest, hence it is called Āraṇyaka. In the Satarprakaraṇa, instructions for studying the Āraṇyaka are mentioned. Here, the specific ritual of the great vow (mahāvrata) is detailed."
934,araṇyādhyayanādetad āraṇyakamitīryate | araṇaye tadadhīyītetyevaṃ vākyaṃ pracakṣyate ||,"This saying is proclaimed: ""Derived from forest-study, it is called 'Āraṇyaka.' It should be studied in the forest."""
935,tasyā bharturabhicāra uktaṃ prāyaścittaṃ rahasyeṣu,The expiation for her husband's transgression was spoken of in secrecy.
936,eṣa vai somo rājā devānāmannaṃ yaccandramāḥ|,"This is indeed the king Soma of the gods' delight, the nourishment that is the moon."
937,yat idaṃ asmin brahmapure daharaṃ puṇḍarīkaṃ veśma daharoഽsmin antarākāśaḥ tasmin yadantaḥ tadanveṣṭavyaṃ tad vāva vijijñāsitavym … …,"What is in this city of Brahma, the small lotus-like abode? In that (same place), what is the interior space? That should be sought after, that should be thoroughly investigated..."
938,śataṃ caikā hṛdasya nāḍyaḥ tāsāṃ mūrdhānamabhiniḥsṛtaikā tayordhvamāyannamṛtatvameti viṣvaṅṅanyā utkramaṇe bhavanti,"A hundred of the heart's vessels, from them one emerges at the top; with this, rising upwards, becoming immortal, is what the traveling one does. The other separate ones at the departure."
939,janmanā brāhmaṇo jñeyaḥ saṃskārairdvija ucyate vidyayā yāti vipratvaṃ tribhiḥ śrotriyalakṣaṇam iti prāyaścittavivekaḥ,"The one born as a brāhmaṇa is to be known by janmanā, and is called dvija by saṃskāraiḥ. With vidyayā, he attains vipratvam through tribhiḥ śrotriyalakṣaṇam, and iti results in the discernment of prāyaḥcitta."
940,agnyādheyaṃ pākayajñānagniṣṭomādikānmakhān | yaḥ karoti vṛto yasya sa tasya rtvigihocyate || ||,"The one who performs the agnyadheya and pakayajnas, including agniSToma and other sacrifices, is considered the rtvik of that person."
941,yathorṇanābhiḥ sṛjate gṛhṇate ca yathā pṛthivyāmoṣadhayaḥ saṃbhavanti | yathā sataḥ puruṣāt keśalomāni tathā'kṣarāt saṃbhavatīha viśvam || ||,"Just as from the navel abscess, [someone] creates and receives [the embryo], and just as plants grow from the earth,
and just as hair grows from the human body, so does this entire universe arise from the imperishable."
942,yaḥ sarvajñaḥ sarvavidyasya jñānamayaṃ tāpaḥ | tasmādetadbrahma nāma rūpamannaṃ ca jāyāte || ||,"The all-knowing one, who is the very embodiment of knowledge of all sciences, becomes the heat and suffering because of that. Therefore, this Brahman is named as such, taking on the forms of food, knowledge, and female."
943,chandāṃsi yajñāḥ kratavo vratāni bhūtaṃ bhavyaṃ yacca vedā vadanti | asmānmāyī sṛjate viśvametattasmiṃścānyo māyayā sanniruddhaḥ || ||,"The meters, sacrifices, and rituals, as well as what has been and will be, the Vedas proclaim. From you is brought forth this entire universe, while another is enveloped by illusion in this very place."
944,māyāṃ tu prakṛtiṃ vidyānmāyinaṃ ca maheśvaram | tasyavayavabhūtaistu vyāptaṃ sarvamidaṃ jagat || ||,"Indeed, understand maya as prakriti and the controller of maya as such. Everything in this world is permeated by the constituents of maya ."
945,mayā'dhyakṣeṇa prakṛtiḥ sūyate sacarācaram|,"By my supervision, nature, both moving and stationary, is manifested."
946,sattvaṃ rajastama iti guṇāḥ prakṛtisaṃbhavāḥ| nibadhnanti mahābāho dehe dehinamavyayam||||,"The three qualities born of nature—purity , passion , and darkness —restrain the eternal self in the body, O mighty-armed one."
947,mūlaprakṛtiravikṛtirmahadādyā: prakṛtivikṛtaya: sapta | ṣoḍaśakastu vikāro na prakṛtirna vikṛti: puruṣa: || ||,"The unmanifest primal nature and the manifest nature, consisting of the great and the subtle, are, respectively, the seven and the sixteen transformations. Yet, there is no transformation in the purusha or the conscious self."
948,tasmātprakṛtirutpannā puruṣeṇa samanvitā || tābhyāntapaḥ kṛtaṃ tatra mūlasthe ca jale sudhīḥ || ||,"Hence, nature arises, endowed with purusha, from which there, simplicity is accomplished in both the fundamental and the water."
949,saṃbhāvya māyayā yuktastatra supto harissa vai || nārāyaṇeti vikhyātaḥ prakṛtirnārāyaṇī matā || ||,"Having been endowed with Maya, the one who is known as Narayana is celebrated as having caused (others) to lie asleep there, and as being united with him, while also being himself asleep. That is considered the primal nature of Narayana."
950,parātmanastathā śaktestayoraikyaṃ sadaiva hi | abhinnaṃ tadvapurjñātvā mucyate sarvadoṣataḥ || ||,"By realizing the non-duality of the supreme self and power, one is constantly freed from all faults, having understood their inseparable oneness."
951,tasya cecchāsmyahaṃ daitya sṛjāmi sakalaṃ jagat | sa māṃ paśyati viśvātmā tasyāhaṃ prakṛtiḥ śivā || ||,"If I, the creator of the daityas, am currently manifesting the entire world for him, then the cosmic soul sees me as his own auspicious nature."
952,rāma māyā dvidhā bhāti vidyā'vidyeti te sadā |,"Rama, maya is twofold, as knowledge and ignorance. You should always remember this."
953,dvividhā tu khalu tadvidyasaṃbhāṣā bhavati sandhāyasaṃbhāṣā vigṛhyasaṃbhāṣā ca |,"Indeed, there are two kinds of speech for the learned: one is conciliatory speech, and the other is harsh speech used in response."
954,prāgeva ca jalpājjalpāntaraṃ parāvarāntaraṃ pariṣadviśeṣāṃśca samyak parīkṣet parīkṣamāṇastu khalu parāvarāntaramimān jalpakaguṇān śreyaskarān doṣavataśca parīkṣeta samyak,"Even before, one should thoroughly examine the qualities of those who engage in argumentative banter, both within their own group and in other groups. While observing, they should accurately assess such jalpaka qualities in them, determining which are beneficial and which are harmful."
955,tadviddhi praṇipātena paripraśnena sevayā | upadekṣyanti te jñānaṃ jñāninastattvadarśinaḥ ||,"Understand this truth through reverence, questioning, and service. Those who have realized the truth will teach you knowledge."
956,jñānagrahaṇābhyāsastadvidyaiśca saha saṃvādaḥ || ||| taṃ śiṣyagurusabrahmacāriviśiṣṭaśreyo'rthibhiranasūyubhirabhyupeyāt || || pratipakṣahīnamapi vā prayojanārthamarthitve || ||,"The practice of acquiring knowledge through discussion with experts is a superior means of spiritual progress for the disciple who is free from envy. Similarly, using negative tendencies in a constructive way can also be beneficial. This is the message."
957,jñāyate'neneti jñānamātmavidyāśāstram | tasya grahaṇamadhyayanadhāraṇe abhyāsaḥ satatakriyā'dhyayanaśravaṇacintanāni tadvidyaiśca | saha saṃvāda iti prajñāparipākārthe paripākastu saṃśayacchedanamavijñātārthabodho'dhyavasitābhyanujñānamiti | samāpavādaḥ saṃvādaḥ | vābhā |,"Knowledge is considered to arise from this (process) – the self-study of atma-vidyaśastra; its acquisition, study, and retention are the continuous practice of adhyayana, listening, and contemplation. For the accomplished ones, discussion with others is also a part of their refinement process, which includes clarifying doubts, understanding the meaning of what is not known, giving consent, and engaging in constructive debates."
958,pramāṇatarkasādhanopālambhaḥ siddhāntāviruddhaḥ pañcāvayavopapannaḥ pakṣapratipakṣaparigrahaḥ vādaḥ ||||,"Debate is the presentation, with supporting reasons and evidence, of a thesis that is consistent with established facts, not in conflict with other principles, based on five limbs (exposition of the subject, reason, example, application, and summary), and encompassing both viewpoints."
959,yathoktopapannaḥ chalajātinigrahasthānasādhanopālambhaḥ jalpaḥ,"Derived from previous compounds, that which is spoken of as having arisen, and is the means of establishing a firm stance against deceitful elements, such is called argumentation."
960,sādharmyavaidharmyotkarṣāpakarṣavarṇyāvarṇyavikalpasādhyaprāptyaprāptiprasaṅgapratidṛṣṭāntānutpattisaṃśayaprakaraṇahetvarthāpattyaviśeṣopapattyupalabdhyanupalabdhinityānityakāryasamāḥ || ||,"The consideration of similarities, dissimilarities, advantages and disadvantages, their descriptions, comprehension, acquisition or non-acquisition, contradictions, examples, origins, doubts, discussions, means of accomplishment, special characteristics, and the manifestation or non-manifestation of actions - all these are equal."
961,pratijñāhāniḥ pratijñāntaraṃ pratijñāvirodhaḥ pratijñāsaṃnyāso hetvantaramarthāntaraṃ nirarthakamavijñātārthamapārthakamaprāptakālaṃ nyūnamadhikaṃ punaruktamananubhāṣaṇamajñānamapratibhā vikṣepo matānujñā paryanuyojyopekṣaṇaṃ niranuyojyānuyogo'pasiddhānto hetvābhāsāśca nigrahasthānāni || ||,"Withdrawal of a promise, contradiction of a previous promise, negation of the meaning of a term, designation of something as different from its true meaning, irrelevant or misunderstood meaning, use of words that are redundant, already stated, or unrelated, ignorance or display of knowledge, distraction, making exceptions, ignoring them, accepting established rules or not, illusions, and establishing the grounds for arguments – these are considered."
962,aviśeṣābhihite arthe vaktuḥ abhiprāyātarthāntarakalpanā vākchalam ||||,"The speaker's intention, different from the expressed meaning in a given context, is what gives rise to the ambiguity of speech."
963,sambhavataḥ arthasya atisāmānyayogātasambhūtārthakalpanā sāmānyacchalam ||||,"The concept/meaning of this arising object, due to the excessiveness of commonness, remains unchanged."
964,dharmavikalpanirdeśe arthasadbhāvapratiṣedhaḥ upacāracchalam ||||,"In the exposition of dharma's controversy, (there is) the rejection of wrong interpretations of meaning and (the establishment of) proper understanding; (it is) prone to fluctuation in application."
965,yadā vādī parasya sādhanaṃ sādhviti manyate lābhapūjākhyātikāmaśca bhavati tadā jātiṃ prayuṅkte kadācidayaṃ jātyuttareṇākulīkṛto nottaraṃ pratipadyate uttarāpratipattyā ca nigṛhyate | anabhidhāne ca jātirekāntajayaḥ parasyetyaikāntikātparājayādvaramastu saṃdeha iti yukto jāteḥ prayogaḥ || nyāvā ||,"When one is considered to regard another's endeavor as proper and seeks fame and worship from it, then they join a different caste. Sometimes, they become polluted by another caste and are held back. In the case of unidentified caste, victory is gained over the other by complete defeat or not. This is the usage in the matter of caste. Thus (it is)."
966,saḥ pratipakṣasthāpanāhīnaḥ vitaṇḍā ||||,"He is the establisher of counter measures, yet not lacking in dignity; and (he is) without argumentativeness."
967,svapakṣarāgeṇa caike nyāyamativartante taca | tattvādhyavasāyasaṃrakṣaṇārthaṃ jalpavitaṇḍe bījaprarohasaṃrakṣaṇārthaṃ kaṇṭakaśākhāvaraṇavat || ||,"Some women, deviating from the principle of partisanship, protect truth and firmness through advocacy and debate to safeguard the establishment of correct knowledge and to preserve the seedling of thought from getting obstructed by thorny branches."
968,vidyānirvedādibhiśca pareṇāvajñāyamānasya | tābhyāṃ vigṛhya kathanam || || vigṛhyeti vijigīṣayā na tattvabubhutsayeti | tadetadvidyāpālanārthaṃ na lābhapūjākhyātyarthamiti |,"By ignoring the teachings starting from detachment and including other disciplines, and being disdained by someone else, one should engage in a discourse, motivated not by a desire to gain knowledge but to establish it. This is not meant for fame or for the sake of acquiring wealth and prestige, but only for the protection and preservation of knowledge."
969,budhajanairvādaḥ parityajyatām || ||,Let the debate be abandoned by the wise.
970,pakṣābhyāṃ ca mayā gupto jaṭāyurna pradahyate| pramādāttatra nirdagdhaḥ patanvāyupathādaham||||,"Protected by both wings, the jaṭā creature is not to be consumed; through inattention there, it gets burned down; I am the one who's engaged in falling downwards from the path of air."
971,purā vṛtravadhe vṛtte parasparajayaiṣiṇau| ādityamupayātau svo jvalantaṃ raśmimālinam||||,"In the past, during the battle against Vritra, you (dual) engaged in combat seeking victory over each other; approaching the radiant and shining Aditya, who is adorned with brilliant rays."
972,taṃ māmevaṃ gataṃ putrassupārśvonāma nāmataḥ| āhāreṇa yathākālaṃ bibharti patatāṃ varaḥ||||,"The excellent son, named Suparsva, sustains me, who has come in this way, with regular nourishment."
