id,sloka,translation
872,अहो कष्टं भ्रष्टोऽहमात्मवतामनुपथाद्यद्विमुक्तसमस्तसङ्गस्य विविक्तपुण्यारण्यशरणस्यात्मवत आत्मनि सर्वेषामात्मनां भगवति वासुदेवे तदनुश्रवणमननसङ्कीर्तनाराधनानुस्मरणाभियोगेनाशून्यसकलयामेन कालेन समावेशितं समाहितं कार्त्स्न्येन मनस्तत्तु पुनर्ममाबुधस्यारान्मृगसुतमनु परिसुस्राव,"Having become deeply attached to the deer, Bharata died watching the deer and thinking of it. Since he thought of the deer while dying, he was born as a deer in his next life. The only difference was that he was born as a jatismara deer, that is, a deer that remembered the incidents of its past life. As a deer, Bharata left his mother and came again to Salagramakshetra because he remembered his old place. He lived on dry leaves and dry grass and lamented as he strayed from the path to realize the Atman due to attachment."
873,तत्रापि स्वजनसङ्गाच्च भृशमुद्विजमानो भगवतः कर्मबन्धविध्वंसनश्रवणस्मरणगुणविवरणचरणारविन्दयुगलं मनसा विदधदात्मनः प्रतिघातमाशङ्कमानो भगवदनुग्रहेणानुस्मृतस्वपूर्वजन्मावलिरात्मानमुन्मत्तजडान्धबधिरस्वरूपेण दर्शयामास लोकस्य,"After he left his beastly form, Bharata was reborn the second time as a jatismara brahmana."
874,तनोति विपुलानर्थान् तत्वमन्त्रसमन्वितान् त्राणं च कुरुते यस्मात् तन्त्रमित्यभिधीयते,"It is also expressed in the meaning of 'to compose', 'to write' as per The Student's Sanskrit English Dictionary by V. S. Apte. The traditional definition of the word tantra given in Sarvatantra siddhanta padarthalakshana sangraha by Bhikshu Gaurishankarais as follows"
875,युज्यन्ते सङ्क्ल्प्यन्ते सम्बध्यन्ते परस्परमर्थाः सम्यक्तया प्राकरणिकेऽभिमतेऽर्थे विरोधव्याघातादिदोषमपास्यानया इति युक्तिः युज् योजने तस्मिन् यक्तिरिति रूपं भवति,"Yukti is a derivative of the the dhatu in the meaning 'to unite', 'join','to employ' etc. The word yukti is an application, an arrangement, a usage, a means, a device etc. Sharma has offered an explanation of yukti as follows"
876,यथाऽम्बुजवनस्यार्कः प्रदीपो वेश्मनो यथा ॥ प्रबोध प्रकाशार्थास्तथा तन्त्रस्य युक्तयः । एकस्मिन्नपि यस्येह शास्त्रे लब्दास्पदा मतिः॥ स शास्त्रमन्यदप्याशु युक्तिज्ञत्वात् प्रबुध्यते ।,Charaka aptly summarizes the role of tantrayuktis as follows
877,धर्ममूलं वेदमाहुः ग्रन्थराशिमकृत्रिमम्। तद्विदां स्मृतिशीले च साध्वाचारं मनःप्रियम् ॥,"Many Sanatana Dharma texts proclaim that Vedas are the pramanas or basis of Dharma. These texts being the oldest in the world with no precedents to them, it is accepted with authority and respect by every follower of the concept of Dharma. Vyasa Maharshi's sayings stand testimony to the vedic authority of dharma as mentioned in Smrtichandrika as follows"
878,श्रौतस्त्रेताग्निसंबन्धात् स्मार्त्तः पूर्वं मयोदितः । श्रेयस्करतमः श्रौतस्तस्माच्छ्रौतं समाचरेत् ।।,"Kurma Purana describing what dharmas are to be followed mentions that Shrauta dharmas involving the tretagni are the most advisable followed by Smarta dharmas. When both Shruti and Smrti texts are unavailable , Shistachara forms the third kind of dharma that is taken as standard for enforcing dharma."
879,उभावभिहितौ धर्मौ वेदवेदविनिःसृतौ । शिष्टाचारस्तृतीयः स्याच्छ्रतिस्मृत्योरलाभतः ।।,Thus it is to be noted that Shistachara is also one source of knowing dharma that is to be followed in particular situations when the same cannot be understood from the vedic and smrti texts.
880,धर्मेणाधिगतो यैस्तु वेदः सपरिबृंहणः । ते शिष्टा ब्राह्मणाः प्रोक्ता नित्यमात्मगुणान्विताः ।।,"Shistaachara means the aachara of a Shista. It is founded in turn on Shrutis and Smrtis . Kurma Purana and Manu define who a or a person of virtuous conduct is, as follows"
881,तेषामभिमतो यः स्याच्चेतसा नित्यमेव हि । स धर्मः कथितः सद्भिर्नान्येषामिति धारणा ।।,"One who is knowledgeable in the dharmik concepts given in Vedas and Paribhrimhanas , and who is filled with Atmagunas engrossed in pursuing the knowledge of Brahman is called Shista . It is laid down that the views held by these Shistas, which are ever present in their Antakarana , are called Dharma by scholarly people and do not constitute the views of those who live otherwise."
882,शिष्टाः खलु विगतमत्सरा निरहंकाराः कुम्भीधान्या अलोलुपा दम्भदर्पलोभमोहक्रोधविवर्जिताः ॥ धर्मेणाधिगतो येषां वेदः सपरिबृंहणः । शिष्टास् तदनुमानज्ञाः श्रुतिप्रत्यक्षहेतवः ॥ इति ॥,Baudhayana Dharmasutras gives elaborate details about who is called a Shista and what his Atma and Buddhi gunas are.
883,धर्मेणाधिगतो यैस्तु वेदः सपरिबृंहणः । ते शिष्टा ब्राह्मणा ज्ञेयाः श्रुतिप्रत्यक्षहेतवः । । ।,"Shistas are devoid of matsarya , ahamkara , hypocrisy, arrogance, greed, moha , anger, they are content and have few desires. They have a though understanding of the Vedas and associated granthas like puranas and itihasas, who can clearly envisage the reasoning that ""this shruti is directly pertinent to this dharma"" , and are experts at pointing out the inferential references of Vedas in Smrtis, acharas, agamas . Thus he is one who, having understood the dharmas defined by the shastras, applies and executes them as per situations .
Manusmrti reiterates the importance of Shistas and their exceptional qualities."
884,दृष्टो धर्मव्यतिक्रमः साहसं च महतां ॥ ̥ṣṭō ḥ āṁ āṁ ॥ इति। साहसं परशुरामादेः मातुः शिरछेदादि।,"In the case of knowing what Aachara pramanas are, even though deviations from Dharma are observed in examples such as those seen with Ahalya and Tara with Indra and Chandra respectively, Gautama explains it as follows"
885,कुशलाचरितेनैषां इह स्वार्थो न विद्यते । विपर्ययेण वानर्थो निरहङ्‌कारिणां प्रभो ॥ ॥,"Transgressing the limits of dharma and over-adventurous acts are found to have been committed by mighty divine beings. But that does not amount to a blemish for those glorious beings, just as the fire having numerous flames . These acts should not be committed even mentally by those beings who are not divine. Such people meet with destruction just like a person, other than Rudra, who swallows the poison that arose by the churning of the ocean. The words of those having divine wisdom are irrefutably truth and authoritative but their actions may be emulated only at certain times. A prudent and intelligent person should follow the actions of such virtuous men only when consistent with their own personal precepts. Such authoritative persons who are devoid of ahamkara have no selfish ends as they work for the welfare of others and gain nothing by acting on the contrary."
886,धर्मज्ञसमयः प्रमाणं वेदाश्च। वेदाश्च,"According to Apastamba the acharas that are followed by a Dharmajna, who is one well-versed in dharmashastras, is also a pramana for dharma."
887,अनान्मातेषु धर्मेषु कथं स्यादिति चेद्भवेत् । यं शिष्टा ब्राह्णा भ्रूयुः स धर्मस्स्यादशाङ्केतः।। । ।,The people constituting the Parishad should have exceptional qualities described in the shastras. The concept of Vidvat Parishads led to modern day thesis defence in our education system wherein a thesis is evaluated by a panel of experts in that particular field. Formation of parishads has extended to other areas where a group of experts in any given field form the Parishad. Manu discusses this aspect as follows
888,तदभावे दशावरा परिषत्।,Yajnavalkya mentions that a Parishad could consist of lesser number of Shistas and among them even if one Atmajnani is present his decision is to be accepted and followed as dharma in matters of ambiguity.
889,चत्वारो वेदधर्मज्ञाः परिषत्रैविद्यमेव वा। सा ब्रूते यं स धर्मस्स्यादेको वाऽध्यात्मवित्तमः।।,Yajnavalkya mentions that a Parishad could consist of lesser number of Shistas and among them even if one Atmajnani is present his decision is to be accepted and followed as dharma in matters of ambiguity.
890,वेदाः प्रमाणं स्मृतयः प्रमाणं धर्मार्थयुक्तं वचनं प्रमाणम्। यस्य प्रमाणं न भवेत्प्रमाणं न तस्य कुर्याद्वचनं प्रमाणम्।।,"Summary: Vedas, smrtis and the advices of dharma and artha are pramanas. Those whose pramanas do not include any of the above pramanas such a persons words are not to be considered as having any basis or pramanas, and hence should be ignored."
891,तथा सम्प्रदायोऽपि कचित्प्रमाणमित्याह मनुः। स्वकुलपरम्परायात आचारः सम्प्रदायः। सोऽपि शास्त्रविप्रतिपत्तौ द्रष्टव्यः।,"Along with the above Dharma pramanas, Sampradaya also has been considered as pramana in some instances according to Manu. Sampradaya is defined as those aacharas that have come down traditionally in ones own community/family. Where there are differences in aacharas according to shastras, that particular sampradaya has to be followed."
892,न मेऽन्यत्र क्षत्रियाया मनो जातु प्रवर्तते। ऋषिपुत्रीषु चान्यासु नावरासु परासु च।।,"A good example of Atma pramana is seen in Mahabharata in the Adi Parva, when Dushyanta speaks about his inner conscience advising him that it was not against his dharma to make an offer of marriage to Shakuntala, at Kanva Maharshi's ashram, even though he does not know her lineage."
893,तस्मात्प्रणिहितात्मानं विद्दि मां कलभाषिणि। यस्यां मे त्वयि भावोऽस्ति क्षत्रिया ह्यसि का वदा।।,"Dushyanta, while on a hunting trip visits the Kanva ashram one day. There, he comes across an exquisitely beautiful Shakuntala and is immediately attracted to her beauty. Dushyanta had never seen a maiden of such grace, charm and beauty. He comes to know that she is a hermit girl. Realizing that he has lost his heart to her, he is intrigued by the thought as to how he can fall in love with a sage's daughter. He enquires about her and finds out that she is born to Vishwamitra, a Kshatriya, and Menaka and comes to know that she is indeed a Kshatriya-girl. He is elated about the fact that even his heart did not fail him in performing the dharma or the righteous act and since Shakuntala is a Kshatriya-girl, he was not wrong in losing his heart to her."
894,स्मृतिः प्रत्यक्षमैतिह्यम् । अनुमानश्चतुष्टयम् ।,"Pramanas are in a way standards for examination, verification, modification and confirmation of our knowledge. A mention of Pramanas is made in the Taittriya Aranyaka as follows"
895,तत्र यस्येप्साजिहासाप्रयुक्तस्य प्रवृत्तिः स प्रमाता । स येनार्थं प्रमिणोति तत्प्रमाणं । योऽर्थः प्रतीयते तत्प्रमेयं । यदर्थविज्ञानं सा प्रमितिः । चतसृषु चैवंविधास्वार्थतत्वं परिसमाप्यते ।,Four basic factors make up the system of recognition according to Nyaya darshana. Since all the fundamental aspects of cognition are explained in this shastra sutras from Nyaya are taken as a standard. Vatsyayana Bhashya of Nyayasutras defines the 4 components as follows
896,यथा रजते इदं रजतमिति ज्ञानम्। सैव प्रमेच्युते ॥॥,"Similar to Nyaya, Annambhatta's Tarkasangraha explains that Yatartha Jnana is Prama. It clearly defines the difference between Prama and Aprama as followsSummary: Thus Prama is that which pertains to definite knowledge of an object which is true presentational in character, just as the knowledge an object of silver as ""this is silver"". Here the knowledge about the quality of silverness of the object is in toto without any distortion to silver."
897,प्रमाणमनुभूतिः सा स्मृतेरन्या न सा स्मृतिः । न प्रमाणं स्मृतिः पूर्वप्रतिपत्तिव्यपेक्षणात्।,"Prabhakara Mimamsa: They define prama or valid knowledge as immediate experience . It is different from smrti or memory which is the impression of past experiences. That is to say 'valid cognition' is Apprehension. Hence according to them the truth of knowledge, praamaanya is guaranteed by its having the characteristic of immediacy."
898,आत्मशरीरेन्द्रियार्थबुद्धिमनःप्रवृत्तिदोषप्रेत्यभावफलदुःखापवर्गाः तु प्रमेयम्।। ।।{प्रमेयौद्देशसूत्रम्},"Nyaya sutras of Gautama explicitly define the Premaya or the objects of cognition, which are to be known. It is classified into 12 kinds."
899,प्रमाणतोऽर्थप्रतिपत्तौ प्रवृत्तिसामर्थ्थदर्थवत् प्रमाणम् । तस्येप्साजिहासाप्रयुक्तस्य समीहा प्रवृत्तिरित्युच्यते । द्वयोरेकतरस्य चापि असन्निकृष्टार्थपरिच्छित्तिः प्रमा तत्साधकतमं यत्तत्त्रिविधं प्रमाणं । सांख्यसूत्र ।,The means of Prama is termed Pramana as explained by the Vatsyayana bhashya given below.
900,तत्र यस्येप्साजिहासाप्रयुक्तस्य प्रवृत्तिः स प्रमाता ।,Pramata refers to the person involved in action motivated by the desire to obtain an object or desire to keep away an object .
901,अग्ने समिधमाहार्षं बृहते जातवेदसे । स मे श्रद्धां च मेधां च जातवेदाः प्र यच्छतु ॥,"A bachelor should with devotion pray to surya and agni during both sandhyakala and also pay respects to his guru.
In Atharva veda the importance of conducting samidadhana is expressed"
902,अथ सप्त पालाशीः समिध आर्द्रा अप्रच्छिन्नाग्राः प्रादेशमात्रा घृताक्ता अभ्याधापयति ।,"A bachelor placing the samidha in Jatavedas prays to him to grant shraddha and medhas.
Agnivesyagrhyasutra outlines the process and mantras as follows Summary: Seven Palasha samidhas which do not have split ends along with ghee are to be offered."
903,अग्निं परिसमूह्य ब्रह्मचारी तूष्णीं समिधमादध्यात् तूष्णीं वै प्राजापत्यं प्राजापत्यो ब्रह्मचारी भवतीति विज्ञायते,Within Ashvalayana Grhya sutras the mantras to be recited during samidadhana are given
904,स इद्भोजो यो गृहवे ददात्यन्नकामाय चरते कृशाय । अरमस्मै भवति यामहूता उतापरीषु कृणुते सखायम् ॥ बलं बलवतो नश्येदन्नहीनस्य देहिनः। तस्मादन्नं विशेषेण श्रद्धयाश्रद्धयापि वा॥ आदत्ते हि रसं सर्वमादित्यः स्वगभस्तिभिः। वायुस्तस्मात्समादाय रसं मेघेषु धारयेत्॥ तत्तु मेघगतं भूमौ शक्रो वर्षति तादृशम्। तेन दिग्धा भवेद्देवी मही प्रीता च भारत॥ तस्यां सस्यानि रोहन्ति यैर्जीवन्त्यखिलाः प्रजाः। मांसमेदोऽस्थिमज्जानां सम्भवस्तेभ्य एव हि॥,"Rig Veda describes the greatness of Anna as supreme and extols Annadata in Sukta 117 of Mandala 10, a few mantras as follows"
905,नीरजातश्च भगवान्सोमो ग्रहगणेश्वरः। अमृतं च सुधा चैव स्वाहा चैव स्वधा तथा॥ अन्नौषध्यो महाराज वीरुधश्च जलोद्भवाः। यतः प्राणभृतां प्राणाः सम्भवन्ति विशाम्पते॥ देवानाममृतं ह्यन्नं नागानां च सुधा तथा। पितॄणां च स्वधा प्रोक्ता पशूनां चापि वीरुधः॥,"Mahabharata, in Anushasana Parva lays down the importance of Jala or water giving rise to anna and the different forms that constitute anna for different beings."
906,तस्माद्वा एतस्मादात्मन आकाशः संभूतः । आकाशाद्वायुः । वायोरग्निः । अग्नेरापः । अद्भ्यः पृथिवी । पृथिव्या ओषधयः । ओषधीभ्योऽन्नम् । अन्नात्पुरुषः ।,"In Taittriya Upanishad, the teaching of brahmavidya, starts with an exposition of how Brahman creates and manifests himself in the Universe."
907,स वा एष पुरुषोऽन्नरसमयः । तस्येदमेव शिरः । अयं दक्षिणः पक्षः । अयमुत्तरः पक्षः । अयमात्मा । इदं पुच्छं प्रतिष्ठा । तदप्येष श्लोको भवति ॥,"The purusa here stands for the man for the individuated self according to Sri Sankara. To emphasize the annamayatva, the attribute of being born from anna, of the purusa the seer says:"
908,अहमस्मि प्रथमजा ऋतस्य । पूर्वं देवेभ्यो अमृतस्य नाभिः । यो मा ददाति स इदेव माऽऽवाः । अहमन्नमन्नमदन्तमद्मि ।,"In the Taittriya Brahmana of the Krishna yajurveda we hear annadevata, the devata residing in food, himself speaking about the importance of food and of the inviolability of the discipline of giving before eating, in words that are often reminiscent of the teachings of Bhiksu Angirasa. The eighth anuvaka of the eighth prapathaka of the second astaka of the brahmana quotes the annadevata proclaiming thus:"
909,अन्नं प्राणमन्नमपानमाहुः । अन्नं मृत्युं तमु जीवातुमाहुः । अन्नं ब्रह्माणो जरसं वदन्ति । अन्नमाहुः प्रजननं प्रजानाम् ।,"I, the annadevata, am the first progenitor of yajna: the first yajna born of me. It is I who, at the earliest times, become the nucleus of amrta for the devas. The one who gives me is in fact the one who obtains me. On the other hand, the one who does not give is consumed by me. I am the annadevata, I eat the one who does not give anna."
910,भोजयेच्छ्वभ्यः श्वपचेभ्यश्च वयोभ्यश्चावपेद्भूमाविति नानवत्तमश्नीयान्नैको न पूर्वं । तदप्येतदृचोक्तं मोघमन्नं विन्दते अप्रचेता इति,"In Bhutayajna, bali is to be offered not into fire but on the ground, which is wiped and cooked food is placed on it. These directions to give food even to outcasts, dogs and birds were the outcome of the noble sentiment of universal kindliness and charity, the idea that One Spirit pervades and illumines the even the meanest of creatures and binds all together. Shankhayana Grhyasutras winds up its vaisvadeva section with this fine exhortation:"
911,मोघमन्नं विन्दते अप्रचेताः सत्यं ब्रवीमि वध इत्स तस्य । नार्यमणं पुष्यति नो सखायं केवलाघो भवति केवलादी ॥,"Let him throw food to dogs, to svapachas , to birds on the ground; let him eat nothing without having cut off a portion ; let him not eat alone, nor before others since the Rig Veda mantra says ""the fool gets food in vain"""
912,अभ्यागतो ज्ञातपूर्वो ह्यज्ञातोऽतिथिरुच्यते।,"In the Mahabharata, Srikrishna, while advising Yudhisthira on the discipline of annadana, emphasizes this fundamental distinction between a guest who is already acquainted and the one who comes unknown and uninvited. The former, Srikrishna says, is called abhyagata , the latter alone is an atithi"
