id,sloka,translation
582,athātaḥ pañcayajñāḥ devayajño bhūtayajñaḥ pitṛyajño brahmayajño manuṣyayajña iti tadyadagnau juhoti sa devayajño yadbaliṅkaroti sa bhūtayajño yatpitṛbhyo dadāti sa pitṛyajño yatsvādhyāyamadhīyate sa brahmayajño yanmanuṣyebhyo dadāti sa manuṣyayajña iti tānetānyajñānaharahaḥ kurvīta,"Then, he should perform the five sacrifices: the sacrifice to the gods is what he offers in the fire; the sacrifice to beings is what he gives as alms; the sacrifice to ancestors is what he gives to them; the sacrifice of studying and teaching the Vedas is what one studies and teaches; the sacrifice to people is what he gives to them."
583,vidārite varāhasya kāye bhargeṇa tatkṣaṇāt | brahmaviṣṇuśivā devāḥ sarvaiśca pramathaiḥ saha | ninyurjalāt samuddhṛtya tat śarīraṃ nabhaḥ prati | tadvibhejuḥ śarīrantu viṣṇoścakreṇa khaṇḍaśaḥ | tasyāṅga sandhito yajñājātāste vai pṛthakpṛthak | yasmād yasmācca ye yajñāstat śṛṇvantu maharṣayaḥ| bhrūnāsāsandhinā jāto jyotiṣṭomo mahādhvaraḥ | hanuśravaṇasandhyostu vahniṣṭomo vyajāyata | cakṣurbhruvoḥ sandhinā tu vrātyastomo vyajāyata | āyuḥ paugarbhavastomastasya potroṣṭha sandhinā | vṛddhastoma vṛhatstomau jihvāmūlādvyajāyata | atirātraṃ savairājamadhojihvāntarādabhūt | adhyāpanaṃ brahmayajñaḥ pidvayajñastu tarpaṇam | homo daivo valibhauto nṛyajño'tidhipajatam | snānaṃ tarpaṇaparvyantaṃ nityayajñāśca sāṃśaḥ | kaṇṭhasandheḥ samutpannā jihvāto vidhayastathā | yavājimedho mahāmedho naramedhastathaiva ca | prāṇihiṃsākarā ye'nye te kṣātāḥ pādasandhitaḥ | rājasūyo'tha kārīrī vājapeyastathaivaca | pṛṣṭhasandhau samutpannā grahayajñāstathaiva ca |,"In this manner, the deities Brahma, Vishnu, and Shiva, along with all the ghosts, have at once extracted the body of Varaha from the water. They trembled in fear of its limbs, as they were torn apart by Viṣṇu's discus. The yajnas (sacrificial rites) that originated from his limbs are well-known to the great sages. Jyotiṣṭoma and other Ājā sacrifices emerged from his nasal area; Vahniṣṭoma arose from the union of the speech and ear regions; Vṛātyastoma was born from the eye and eyebrow region; Āyustoma originated from the throat region; and Vṛddhastoma, Vṛhatstoma emerged from the root of the tongue. The great Adhyāpana sacrifice arose from between the two rows of teeth, while other sacrifices such as Atirātra were born in various parts of his body.

The Brahmayajña is performed with knowledge, Pidvayajña for offspring, Tarpaṇa for ancestors, Homa to please deities, and Valibhauta sacrifice for all beings. The Nṛyajñas are dedicated to human needs. Snāna (bath) and other rites related to Tarpaṇa constitute the daily sacrifices.

The Yavājimedha is a great sacrifice, Naramedha a still greater one, while Prāṇihiṃsākarā and others are performed in various ways. The Rājasūya is dedicated to royal consecration; Kārīrī denotes the Vājapeya rite; Grahayajñas are related to planets; and sacrifices are also performed during eclipses and other celestial phenomena, as well as in various seasons."
584,evaṃ yaḥ sarvabhūtāni brāhmaṇo nityaṃ arcati | sa gacchati paraṃ sthānaṃ tejomūrtiḥ pathā rjunā | | | |,"The brahmana who constantly worships all beings in this way, attains the radiant form and goes to the supreme abode."
585,agnau gurāvātmani ca sarvabhūteṣvadhokṣajam | bhūtaiḥ svadhāmabhiḥ paśyedapraviṣṭaṃ praviṣṭavat || || evaṃ vidho brahmacārī vānaprastho yatirgṛhī | caran viditavijñānaḥ paraṃ brahmādhigacchati || ||,"In the fires and in the revered self, as well as in all beings, one should perceive the imperishable Atman. The embodied being sees it entering and exiting (the bodies) through the vital breaths. Thus, a student who has understood this and is pure becomes a forest-dweller, ascetic, or householder; such a person, with knowledge gained from experience, reaches the ultimate Brahman."
586,ya॒masya̭ mā ya॒myaṃ kāma॒ āga̭ntsamā॒ne yonaṷ saha॒śeyyā̭ya | jā॒yeva॒ patyḙ ta॒nva̭ṃ riricyā॒ṃ vi ci̭dvṛheva॒ rathyḙva ca॒krā ||,"In the battle of life, who wouldn't engage in enmity against death, seeking to be born again with their spouse, just like in a Vedic ritual or a chariot race?"
587,na ti̭ṣṭhanti॒ na ni mi̭ṣantye॒te de॒vānā॒ṃ spaśa̭ i॒ha ye cara̭nti | a॒nyena॒ madā̭hano yāhi॒ tūya॒ṃ tena॒ vi vṛ̭ha॒ rathyḙva ca॒krā ||,"""The gods do not welcome nor recognize those who, acting meanly, roam here; approach the divine assembly with a sacrificial offering, you will be uplifted and honored there."""
588,ā ghā॒ tā ga̭cchā॒nutta̭rā yu॒gāni॒ yatra̭ jā॒maya̭: kṛ॒ṇava॒nnajā̭mi | upa̭ barbṛhi vṛṣa॒bhāya̭ bā॒huma॒nyami̭cchasva subhage॒ pati॒ṃ mat ||,"O fortunate one, become eager to perform the yuga sacrifices at that place where the churning of the ocean of milk took place. Approach Bhumi, the wife of Vishnu, as a bridgeroom, O handsome one."
589,na vā ṷ te ta॒nvā̭ ta॒nvaṃ saṃ pa̭pṛcyāṃ pā॒pamā̭hu॒ryaḥ svasā̭raṃ ni॒gacchā̭t | a॒nyena॒ matpra॒muda̭: kalpayasva॒ na te॒ bhrātā̭ subhage vaṣṭye॒tat ||,"Should not you, oh delight of friends, lay claim to your brother's property with a false pretext, but arrange it through appropriate means? Surely, it is not befitting for you."
590,ayane viṣuve caiva ṣaḍaśītimukheṣu ca| candrasūryoparāge ca dattamakṣayamucyate||,"In the two junctions of the year, at sixteenth day-parts (of the lunar month) and at the meeting of the sun and moon, it is declared to have been given and made imperishable."
591,śatamindukṣaye dānaṃ sahasrantu dinakṣaye | viṣuve śatasahasraṃ vyatīpātetvantakam ||,"A hundred Indus, given in the waning moon period, a thousand at the sunset, during a universal deluge, a hundred times a thousand to ward off calamities."
592,kṛttikāsu mahābhāge pāyasena sasarpiṣā| santarpya brāhmaṇānsādhū~llokānāpnotyanuttamān||,"Having offered oblations of payasam (sweet rice pudding) to the constellation of Kritika, the highly fortunate one should appease the virtuous Brahmins and then attain the supreme world."
593,āhāraṃ maithunaṃ nidrāṃ sandhyākāle tu varjjayet | karma cādhyayanañcaiva tathā dānapratigrahau |,"In the period of sandhyā, one should abstain from eating, sexual activity, and sleep. One should also refrain from actions, studying, and giving/receiving at that time."
594,tato'bhūttrivṛdaoṃkāro yo'vyaktaprabhavaḥ svarāṭyattalliṅgaṃ bhagavato brahmaṇaḥ paramātmanaḥ ||,"The one who arose as the distinct sound Om before the creation, who is self-existent and has an indescribable form, is the supreme self of the divine Brahman."
595,svadhāmno brāhmaṇaḥ sākṣādvācakaḥ paramātmanaḥ sa sarvamantropaniṣadvedabījaṃ sanātanam ||,"The brahmin, manifesting the Self's abode in person, is indeed the eternal seed of all mantras and Upanishads."
596,tenāsau caturo vedāṃścaturbhirvadanairvibhuḥ savyāhṛtikānsaoṃkārāṃścāturhotravivakṣayā || ||,"By this, he (the Sun god) illuminates the four Vedas with his four radiant faces."
597,te paramparayā prāptāstattacchiṣyairdhṛtavrataiḥ caturyugeṣvatha vyastā dvāparādau maharṣibhiḥ || ||,"These (te) have been directly received through the traditional lineage, the teachings adhered to by the disciples in the four yugas, previously passed down by great sages in the dvapara age."
598,parāśarātsatyavatyāmaṃśāṃśakalayā vibhuḥ avatīrṇo mahābhāga vedaṃ cakre caturvidham || asmin yuge kṛto vyāsaḥ pārāśaryaḥ parantapaḥ| dvaipāyana iti khyāto viṣṇoraṃśaḥ prakīrtitaḥ ||,"Born of Parāśara and Satyavatī, the all-powerful one took on a bodily form, creating the fourfold Veda in this age. Vyāsa, known as Dvaipāyana, born into the lineage of Viṣṇu, you performed the dutiful task in this era."
599,tatrargvedadharaḥ pailaḥ sāmago jaiminiḥ kaviḥ | vaiśaṃpāyana evaiko niṣṇāto yajuṣāmuta || || atharvāṅ‌girasāmāsīt sumanturdāruṇo muniḥ |,"Among them, the guardian of the Rigveda is Paila, and Jaimini of the Samaveda; Vaisampayana alone is well-versed in the Yajurveda; a sage named Sumantu has deeply mastered the Atharvangirasa."
600,pādenārthena copetā vṛttabaddhā mantrā ṛcaḥ| gītirūpā mantrāḥ sāmāni| vṛttagītivarjitatvena praśliṣṭapaṭhitā mantrā yajūṃṣi|,"Oh ārtha, along with the pāda, you should recite the mantras and ṛcas that are bound by vṛtta. The gīti and rūpā mantras are sāmāni. The mantras, which are causal present participle of varjita, are specially established when they are not connected with yajūṃṣi, through the instrumental singular mantrā."
601,śabdātirikta śabdopajīvipramāṇātiriktaṃ ca yatpramāṇaṃ tajjanyapramitiviṣayānatiriktārthako yo yastadanyatve sati āmuṣmikasukhajanakoccāraṇakatve sati janyajñānājanyo yo pramāṇaśabdastattvaṃ vedatvam iti ca prācīnastallakṣaṇamuktam |,"That which is a means of valid knowledge, separate from words and dependent on words, such a means of valid knowledge is called ""jnyana-pramana"" in the context of discussing the object of cognition of hetu (reason) in inference. This has been classically defined in ancient texts. The word that signifies this means of valid knowledge becomes ""veda"" (true knowledge) when it leads to the realization of the self, which is distinct from other objects and causes happiness, knowledge, and experience."
602,ṛcāṃ tva: poṣamāste pupuṣvāngāyatraṃ tvo gāyati śakvarīṣu | brahmā tvo vadati jātavidyāṃ yajñasya mātrāṃ vi mimīta u tvaḥ ||,"You, who have nourished the ṛcas (hymns) in the past, now sing in the Śakvarīs (a group of songs). Brahmā speaks of your acquired knowledge. You also set the measure for the yajña (sacrifice)."
603,nāma vā ṛgvedo yajurvedaḥ sāmaveda ātharvaṇaścaturtha itihāsapurāṇaḥ pañcamo vedānāṃ vedaḥ pitryo rāśirdaivo,"Indeed, the fourth is named Rigveda, Yajurveda the second, the third Samaveda, and  Atharvana; the fifth, rooted in tradition, is called Itihasa-Purana, as the ancestral one among the Vedas, and Dvaivo (two gods or sacred texts)."
604,purāṇaṃ pañcamo veda iti brahmānuśāsanam,"The fifth Veda, as proclaimed by Brahma, is the ancient Purana."
605,ṛgyajuḥsāmātharvākhyā vedāścatvāra uddhṛtāḥ | itihāsapurāṇaṃ ca pañcamo veda ucyate || ||,"The four Vedas known as Rig, Yajur, Sama, and Atharva have been extracted. The fifth Veda is said to be the collection of itihāsa and purāṇa."
606,sañjaya uvāca | taṃ tathā kṛpayāviṣṭamaśrupūrṇākulekṣaṇam | viṣīdantamidaṃ vākyamuvāca madhusūdanaḥ || ||,"Sanjaya, filled with compassion, spoke to him in that manner. Madhusudana, his eyes filled with tears, spoke these words in a dejected state."
607,śrībhagavānuvāca | kutastvā kaśmalamidaṃ viṣame samupasthitam | anāryajuṣṭamasvargyamakīrtikaramarjuna || ||,"The Blessed One said, ""Whence has this impurity befallen you, O Arjuna, in this critical situation? This is unbefitting of a non-Aryan and leads to infamy, not to heaven."""
608,kla‍aibyaṃ mā sma gamaḥ pārtha naitattvayyupapadyate | kṣudraṃ hṛdayadaurbalyaṃ tyaktvottiṣṭha parantapa || ||,"Don't go for cowardice, Pārtha. This does not befit you. Give up this small-hearted weakness and rise, scorcher of foes."
609,arjuna uvāca | kathaṃ bhīṣmamahaṃ saṃkhye droṇaṃ ca madhusūdana | iṣubhiḥ prati yotsyāmi pūjārhāvarisūdana || ||,"Arjuna said, ""How should I fight against Bhishma and Drona in battle, O Madhusudana, with arrows, as they are worthy of worship?"""
610,gurūnahatvā hi mahānubhāvān śreyo bhoktuṃ bhaikṣyamapīha loke | hatvārthakāmāṃstu gurūnihaiva bhuñjīya bhogān rudhirapradigdhān || ||,"By depriving the great masters of their wealth, one may only enjoy a meager living in this world. But by indulging such greedy desires, one should partake of pleasures stained with blood herein, only after becoming a consumer of alms himself."
611,na caitadvidmaḥ kataranno garīyo yadvā jayema yadi vā no jayeyuḥ | yāneva hatvā na jijīviṣāmas te'vasthitāḥ pramukhe dhārtarāṣṭrāḥ || ||,"We indeed do not know which one is superior or if we will conquer, or they will conquer us. Even if we were to kill them, we wouldn't desire to live, having been positioned in front of the Dhārtarāṣṭras."
612,kārpaṇyadoṣopahatasvabhāvaḥ pṛcchāmi tvāṃ dharmasammūḍhacetāḥ | yacchreyaḥ syānniścitaṃ brūhi tanme śiṣyaste'haṃ śādhi māṃ tvāṃ prapannam || ||,"Afflicted by avarice and confusion about duty, I ask you: please tell me decisively what is the best course of action for me. I am your disciple; guide me, who has sought refuge in you."
613,na hi prapaśyāmi mamāpanudyādya cchokamucchoṣaṇamindriyāṇām | avāpya bhūmāvasapatnamṛddhaṃ rājyaṃ surāṇāmapi cādhipatyam || ||,"I do not see, in fact, anyone who could surpass me in restraining the senses from their objects, for having attained a prosperous kingdom and supremacy over even the gods, I am unrivaled."
614,sañjaya uvāca evamuktvā hṛṣīkeśaṃ guḍākeśaḥ parantapa | na yotsya iti govindamuktvā tūṣṇīṃ babhūva ha || ||,"Sanjaya, having spoken to Hrishikesha, said: ""I will not fight,"" and fell silent, O Govinda."
615,tamuvāca hṛṣīkeśaḥ prahasanniva bhārata | senayorubhayormadhye viṣīdantamidaṃ vacaḥ || ||,"The Lord, Hrsikesa, spoke to him in the midst of both armies, a smile on his face, as did Bharama before. He said this word..."
616,śrībhagavānuvāca | aśocyānanvaśocastvaṃ prajñāvādāṃśca bhāṣase | gatāsūnagatāsūṃśca nānuśocanti paṇḍitāḥ || ||,"The blessed Lord said, ""Why do you sorrow for what is unsorrowful, and speak words of wisdom? The wise do not grieve for the departed or for those who have not departed."""
617,na tvevāhaṃ jātu nāsaṃ na tvaṃ neme janādhipāḥ | na caiva na bhaviṣyāmaḥ sarve vayamataḥ param || ||,"Never indeed was I, you, or any of these kings; nor in the future will any of us exist separate from each other."
618,dehino'sminyathā dehe kaumāraṃ yauvanaṃ jarā | tathā dehāntaraprāptirdhīrastatra na muhyati || ||,"The embodied being in this body experiences youth, aging, and also the transition to a new body; yet, unconfused, remains aware of the eternal consciousness therein."
619,mātrāsparśāstu kaunteya śītoṣṇasukhaduḥkhadāḥ | āgamāpāyino'nityāstāṃstitikṣasva bhārata || ||,"""Contact with sensory objects, Kaunteya, such as heat and cold, pleasure and pain, are transient and ephemeral. You must strive to endure them, O Bharata."""
620,yaṃ hi na vyathayantyete puruṣaṃ puruṣarṣabha | samaduḥkhasukhaṃ dhīraṃ so'mṛtatvāya kalpate || ||,"The one who is not troubled by these (events) affects the steadfast, even-tempered man, imbued with both pleasure and pain, as tending towards immortality."
621,nāsato vidyate bhāvo nābhāvo vidyate sataḥ | ubhayorapi dṛṣṭo'ntastvanayostattvadarśibhiḥ || ||,"For those who truly see, there is no existence in the unreal or nonexistence in the real; the nature of both has been realized by the seers as beyond them."
622,antavanta ime dehā nityasyoktāḥ śarīriṇaḥ | anāśino'prameyasya tasmādyudhyasva bhārata || ||,"""These perishable bodies have been spoken of as belonging to the eternal self. Therefore, O Bharata, strive for that which is immeasurable and indestructible."""
623,ya enaṃ vetti hantāraṃ yaścainaṃ manyate hatam | ubhau tau na vijānīto nāyaṃ hanti na hanyate || ||,"The one who knows the killer, and thinks of him as having been killed - neither of these two understands correctly. He does not kill, nor is he killed."
624,na jāyate mriyate vā kadācinnāyaṃ bhūtvā bhavitā vā na bhūyaḥ | ajo nityaḥ śāśvato'yaṃ purāṇo na hanyate hanyamāne śarīre || ||,"""It is never born nor dies, having become or not becoming in the past, enduring, constant, ancient. Though the body is destroyed, it does not get destroyed."""
625,vedāvināśinaṃ nityaṃ ya enamajamavyayam |kathaṃ sa puruṣaḥ pārtha kaṃ ghātayati hanti kam || ||,"How, O Partha, can someone harm/destroy the imperishable one, who is constantly engaged in upholding the Vedas and is born of immortal nature?"
626,vāsāṃsi jīrṇāni yathā vihāya navāni gṛhṇāti naro'parāṇi | tathā śarīrāṇi vihāya jīrṇānyanyāni saṃyāti navāni dehī || ||,"Just as a person discards old garments and takes new ones, similarly the embodied soul casts off worn-out bodies and enters into new ones."
627,nainaṃ chindanti śastrāṇi nainaṃ dahati pāvakaḥ | na cainaṃ kledayantyāpo na śoṣayati mārutaḥ || || acchedyo'yamadāhyo'yamakledyo'śoṣya eva ca | nityaḥ sarvagataḥ sthāṇuracalo'yaṃ sanātanaḥ || ||,"Not cut by weapons, not burned by fire,
Unwetted by water, not dried by wind,
Indestructible, inviolable, never to be consumed,
Eternal, omnipresent, stable, and immovable,
Such is this imperishable entity."
628,avyakto'yamacintyo'yamavikāryo'yamucyate | tasmādevaṃ viditvainaṃ nānuśocitumarhasi || ||,"This unmanifest, incomprehensible, and immutable [entity] is declared. Therefore, having known it thus, you should not grieve."
629,jātasya hi dhruvo mṛtyurdhruvaṃ janma mṛtasya ca | tasmādaparihārye'rthe na tvaṃ śocitumarhasi || ||,"Indeed, for one who is born, death is certain; and for one who has died, birth is certain again. Therefore, you should not grief over a matter that is unavoidable."
630,avyaktādīni bhūtāni vyaktamadhyāni bhārata | avyaktanidhanānyeva tatra kā paridevanā || ||,"O Bhārata, why lament over the manifest and unmanifest beings, which have become hidden within their subtle forms?"
631,āścaryavatpaśyati kaścidena māścaryavadvadati tathaiva cānyaḥ | āścaryavaccainamanyaḥ śa‍ṛṇoti śrutvāpyenaṃ veda na caiva kaścit || ||,"Some see the wondrous as wonderous, and some describe it as such,
While others listen to it as something wondrous, yet not everyone understands."
632,dehī nityamavadhyo'yaṃ dehe sarvasya bhārata| tasmātsarvāṇi bhūtāni na tvaṃ śocitumarhasi || ||,"Indeed, O Bharata, this inherent self within all is indestructible and eternal. Therefore, you should not grieve over any beings."
633,svadharmamapi cāvekṣya na vikampitumarhasi | dharmyāddhi yuddhācchreyo'nyatkṣatriyasya na vidyate || ||,"Even after considering your own dharma, you should not hesitate. For a kshatriya, engaging in a righteous battle is superior to any other action."
634,yadṛcchayā copapannaṃ svargadvāramapāvṛtam | sukhinaḥ kṣatriyāḥ pārtha labhante yuddhamīdṛśam || ||,"""By chance, you wish for the path to heaven to be unobstructed, O Partha. The Kshatriyas find such a battle, bringing happiness to them."""
635,atha cettvamimaṃ dharmyaṃ saṃgrāmaṃ na kariṣyasi | tataḥ svadharmaṃ kīrtiṃ ca hitvā pāpamavāpsyasi || ||,"If you refuse to engage in this righteous battle, then abandoning your own duty and renown, you will incur sin."
636,akīrtiṃ cāpi bhūtāni kathayiṣyanti te'vyayām | sambhāvitasya cākīrtirmaraṇādatiricyate || ||,"""Even the born ones will mention your disgrace, but for one who is established, their undying fame is told of from the time of death."""
637,bhayādraṇāduparataṃ maṃsyante tvāṃ mahārathāḥ | yeṣāṃ ca tvaṃ bahumato bhūtvā yāsyasi lāghavam || ||,"You will be considered with great esteem by the mighty charioteers who, due to fear of battle, have withdrawn, if you, being highly valued, choose to proceed lightly against them."
638,avācyavādāṃśca bahūnvadiṣyanti tavāhitāḥ | nindantastava sāmarthyaṃ tato duḥkhataraṃ nu kim || ||,"""Those who are close to you will utter inexpressible criticisms and even denigrate your abilities. What could be more distressing than this?"""
639,hato vā prāpsyasi svargaṃ jitvā vā bhokṣyase mahīm | tasmāduttiṣṭha kaunteya yuddhāya kṛtaniścayaḥ || ||,"Even if defeated, you will attain heaven; by conquering, you will enjoy the earth. Therefore, O Kaunteya, resolved to fight, arise."
640,sukhaduḥkhe same kṛtvā lābhālābhau jayājayau | tato yuddhāya yujyasva naivaṃ pāpamavāpsyasi || ||,"Treating pleasure and pain, gain and loss, and victory and defeat as the same, prepare yourself for battle in this way, you will not incur sin."
641,eṣā te'bhihitā sāṃkhye buddhiryoge tvimāṃ śṛṇu | buddhyā yukto yayā pārtha karmabandhaṃ prahāsyasi || ||,"This, revealed in Sankhya, is your understanding in yoga. Listen, Partha, to the discipline that, when united with it, will allow you to cast off the bond of action through the power of this very insight."
642,nehābhikramanāśo'sti pratyavāyo na vidyate | svalpamapyasya dharmasya trāyate mahato bhayāt || ||,"Here, there is no downfall nor regret; even a slight observance of one's duty saves one from great fear."
643,vyavasāyātmikā buddhirekeha kurunandana | bahuśākhā hyanantāśca buddhayo'vyavasāyinām || ||,"O Kurunandana, the resolute-natured intellect is single, but the intellects of those lacking resolve are many and infinite."
644,kāmātmānaḥ svargaparā janmakarmaphalapradām | kriyāviśeṣabahulāṃ bhogaiśvaryagatiṃ prati || || bhogaiśvaryaprasaktānāṃ tayāpahṛtacetasām | vyavasāyātmikā buddhiḥ samādhau na vidhīyate || ||,"Those who have desires as their souls, seeking heaven and fruits of actions as their goal, such a numerous variety of deeds leading to enjoyment and power does not result in steadfastness of intellect in samadhi. For those who are attached and whose intellects are stolen by that (i.e., enjoyment and power), a resolute intellect is not established in samadhi."
645,traiguṇyaviṣayā vedā nistraiguṇyo bhavārjuna | nirdvandvo nityasattvastho niryogakṣema ātmavān || || yāvānartha udapāne sarvataḥ saṃplutodake | tāvānsarveṣu vedeṣu brāhmaṇasya vijānataḥ || || karmaṇyevādhikāraste mā phaleṣu kadācana | mā karmaphalaheturbhūrmā te saṅgo'stvakarmaṇi || ||,"Arjuna, the Vedas pertain to the three gunas, but one who is free from these gunas is truly established in pure consciousness. Unattached and unwavering, such a person transcends duality and material endeavor. 

To what use are extensive scriptural discussions for one who sees that the essence of all is the same? Like a pool of water on a boat, his needs are already fulfilled. For the self-realized scholar, all the Vedas are only as useful as a small well in a floodplain.

Action is your right, never its fruits; let not your attachment be to inaction or to the results of action, Arjuna. O Dhananjaya, be steadfast in yoga, unattached to success or failure. Such evenness of mind is called yoga."
646,arjuna uvāca sthitaprajñasya kā bhāṣā samādhisthasya keśava | sthitadhīḥ kiṃ prabhāṣeta kimāsīta vrajeta kim‌ || ||,"Arjuna said: How does the steady-minded person speak, O Keshava? How does he behave and how should he sit or move?"
647,bhagavañjāyate tīvraṃ cintayānasya suvrata || karmapākaphalaṃ yasminmānuṣairupabhujyate|||| ñāē īṁ ā || āṁ āṣē||||,"The blessed one is born from intense contemplation; understand, what is the fruit of action that humans enjoy in him."
648,ṛṣiruddālakirdīkṣāmupagamya tataḥ sutam| tvaṃ māmupacarasveti nāciketamabhāṣata||,"Having approached the seer, After performing the initiation rites, you (singular) should serve me, he (Nāciketam) said (to him)."
649,tadā kṣamasveti prārthayamānasyaiva tasya nāciketasya deho gatasatvo bhūmau nyapatat patitaṃ sutaṃ dṛṣṭvā pitāpi kiṃ mayānuṣṭhitaṃ pāpeneti bruvan bhūmau nipapāta,"Then, as he was being prayed to for forgiveness, the embodied soul of Naciketas departed. The father, sitting on the ground, saw his son dead. He said, ""What have I done through my actions that this calamity has befallen me?"""
650,na dṛṣyate mānuṣaṃ te vapuḥ,His human form is not visible.
651,yasminvṛkṣe supalāśe devaiḥ sampibate yamaḥ | atrā no viśpati: pitā purāṇā~ anu venati ||,"In which tree, the sacred fig, does Yama offer oblations to the gods? Here, our ancient progenitor performs his worship."
652,tatko vṛtraḥ| megha iti nairuktāḥ | tvāṣṭro'sura ityaitihāsikāḥ | apāṃ ca jyotiṣaśca miśrībhāvakarmaṇo varṣakarma jāyate | tatropamārthena yuddhavarṇā bhavanti |,"Who is that vṛtra (enemy) known as megha in the tradition of Nairuktas, and Tvāṣṭra or Asura according to the itihāsa texts? From the mixture of water and light, the act of rainfall is produced. Then, with a comparison to that, names of warlike activities arise."
