id,sloka,translation
1,चिन्मयस्याद्वितीयस्य निष्कलस्याशरीरिणः । उपासकानां कार्यार्थे ब्रह्मणो रूपकल्पना ॥,"Somewhere in the remote past the religious outlook, rituals and the sacred Yajnas of the vedic period were gradually supplemented by worship through images. The abstract symbolism of the Yajna, was generally replaced by the Puja of images and the concept is called Vigraharadhana ."
2,देवेभ्यः स्वाहाकार आ काष्ठात्,According to Dharmasutras Devayajna consisted of putting into fire offerings with ' svaha' uttered after the name of the deities in the dative case
3,तस्मादपः सम्भरति तस्माद्धिरण्यं सम्भरति तद्द्यावापृथिव्यो रसेन समर्धयति तस्मादूषान्त्सम्भरति तस्मादाखुकरीषं सम्भरति,"He who is to perform the installation of the sacred Agnis gathers the requisite materials. He collects water, gold, salts, earth , pebbles. Each of these have their significance which is explained therein. The place where the fires are to be installed are cleaned and sprinkled with water. Water is verily food, as where water is present it flourishes with food. Gold makes the fire grow with splendour, for gold is indeed the seed of fire. Salt is considered the essence of Dyava and Prithvi, and when offered it makes the fire prosper with their essence. Where there is saltish ground they declare it fit for cattle. The earth collected from a mole hill enriches the fire with the essence of the earth. The earth is made firm and steady by the fixing of pebbles just as one would spread out a hide with pins. In this manner, the yajamana keeps away his inimical rivals by making this ground firm and steady and by installing the fires on it."
4,कृत्तिकासु रोहिण्यां मृगशिरसि फल्गुनीषु विशाखयोरुत्तरयोः प्रोष्ठपदयोः ॥,"This ceremony is to be performed when chandra is situated in certain nakshatras. Krittika, Rohini, Mrgasira, Phalguni , Vishakha and Hasta, Chitta stars are preferred according to different Shrauta sutras."
5,कृत्तिकासु ब्राह्मण आदधीत मुख्यो ब्रह्मवर्चसी भवति गृहांस्तस्याग्निर्दाहुको भवति ॥,Kanvasatapatha brahmana instructs that the installation of Agni under the constellation of Krittika is preferred as Krittika is verily the star of Agni.
6,वसन्तो ग्रीष्मो वर्षाः । ते देवा ऋतवः शरद्धेमन्तः शिशिरस्ते पितरो य,"The people of different sections are advised to establish fire in different seasons, however, they may establish in any season as performing homa is more important than waiting for the appropriate time because a person may die at any time and instead of waiting for right time it is better to establish the fires."
7,रात्रिं जागरणधारणे शकलैर्वा,"On the Upavastha day , the yajamana prepares himself by taking the purificatory bath, achamana , and Punyahavachana. He then takes his seat along with his wife on the darbha grass and pronounces his will to set up the sacred agnis, formally announces his rtviks and honours them by offering Madhuparka . He fasts through the day and remains awake the whole night tending to the fire by adding samidhas."
8,शमीगर्भादग्निं मन्थति । एषा वा अग्नेर्यज्ञिया तनूः ।,The stick on top called the Uttara-arani is called Pururavas and the lower arani called as Aadhara-arani is called Urvasi . The rope used for manthana is called rasanaa. The process of generating fire is also described in various Shrauta sutra texts apart from Taittriya Brahmana in the under prapathaka .
9,स भूर्भुव इत्येतैस्त्रिभिरक्षरैर्गार्हपत्यमादधाति द्वे परिशिनष्ट्ययातयामतायै,"While chanting the mantras, Adhvaryu establishes the Garhapatya Agni on the dried cow dung cakes and places some darbha around it. . According to Kanva Shatapatha BrahmanaSummary: He installs the Garhapatya with the these three syllables Bhurbhuvah."
10,यो अश्वत्थः शमीगर्भ आरुरोह त्वेसचा । तं त्वाहरामि ब्रह्मणा यज्ञियैः केतुभिः सहेति पूर्णाहुत्यन्तमग्न्याधेयं,Thus the process starts with the collection of Arani and ends with Purnahuti.
11,पुनराधेयमाधानाऽप्रतिज्ञातस्य राज्ययशस्कामस्य वा त्रिरात्रावरमग्नीनुत्सृज्य सद्यो वा पुनर्वस्वोः वर्षासु मध्यन्दिने वा कुशैराधानम् व्रीह्यपूपमर्कपलाशयोः पक्वं गार्हपत्यस्थाने निदधात्येवमाहमनीयस्य यावं सद्यश्चेत्,"According to Katyayana Shrauta Sutras is described as followsSummary: The re-establishment of Agni takes place in Punarvasu nakshatra of the rainy season during mid-day. Kushagrass is to be placed . Ahuti made by cooking Vreehi along with other items is to be placed in Garhapatya agni, yava grains to be offered in Aahvaniya."
12,नानाहिताग्निर्नायज्वा विप्रो नाप्यसहस्रदः ।,Ramayana mentions about the worship of agnis and performance of yajnas as follows.
13,अयज्ञो वा एषः । योऽपत्नीकः ।,According to Taittriya Brahmana one who does not have a patni or wife cannot perform yajnas.
14,एतद्वै जरामर्यं सत्रं यदग्निहोत्रं जरया वा ह्येवास्मान्मुच्यते मृत्युना वा पयसा नित्यहोमः,According to Satapatha BrahmanaSummary: this agnihotram is 'jaraamarya satra' because he can get relief from this only if he dies or becomes old.
15,यवागूरोदनो दधि समिग्रामकामान्नाद्यकामेन्द्रियकामतेजस्कामानां,"Although performing agnihotra is a regular activity, it is also performed to attain some special desires called as Kamya Agnihotra. Agnihotra is also performed to fulfill desires such as to achieve heavenly position, a long life of people or cattle, for abundant food grains, brahmavarchas and for physical strength."
16,धूमायन्त्याम् ग्राम कामस्य जुहुयात् । ज्वलन्त्याम् ब्रह्म वर्चस कामस्य । अङ्गारेषु पशु कामस्य ।,Ahutis are made in smoke for those desiring villages . Those aspiring for brahmavarchas should offer ahutis in flames and those desiring cattle wealth should offer ahutis when ambers are shining.
17,जातं वात्सप्रेणाभिमृश्योत्तरेण यजुषोपस्थ आधायोत्तराभ्यामाभिमन्त्रणं मूर्धन्यवघ्राणं दक्षिणे कर्णे जापः सर्षपान्फलीकरणमिश्रानञ्जलिनोत्तरैस्त्रिस्त्रिप्रतिस्वाहाकारं हुत्वा संशास्ति प्रविष्टे प्रविष्ट एव तूष्णीमग्नावावपतेति,"The father takes a sachela snanam as soon as he hears about the birth of the child. During Abhimarshanam outlined in Apastamba grhya sutras , Agnihotra is lit and Raksha homam is conducted in the fire called Sootakagni. Mustard seeds and rice flakes are offered as aahuti by the father."
18,अथैनामुत्तरया दक्षिणे हस्ते गृहीत्वाग्निमभ्यानीयापरेणाग्निमुदगग्रं कटमास्तीर्य तस्मिन्नुपविशत उत्तरो वरः अग्नेरुपसमाधानाद्याज्यभागान्तेऽथैनामादितो द्वाभ्यामभिमन्त्रयेत,Agnihotra is initiated at the time of Paanigrahanam during marriage as given in Apasthamba Grhya Sutras
19,सायंसायं गृहपतिर्नो अग्निः प्रातःप्रातः सौमनसस्य दाता । वसोर्वसोर्वसुदान एधि वयं त्वेन्धानास्तन्वं पुषेम ॥ प्रातःप्रातर्गृहपतिर्नो अग्निः सायंसायं सौमनसस्य दाता । वसोर्वसोर्वसुदान एधीन्धानास्त्वा शतंहिमा ऋधेम ॥,"Atharvaveda describes that Agnihotra performed in the morning and evening keeps the mind fresh, enthusiastic and happy till evening, while the Agnihotra performed in the evening keeps the mind fresh till morning. Saumanas which is cheerfulness of the mind will not be possible unless one is relieved of both physical and mental anxieties and stress.Summary: May Garhapatyagni bestow upon us a superior mind every morning and evening. Hey Agni, grant us growth by giving us good wealth. By offering havisya which increases your lustre let us also gain physical strength. 
Shatapata Brahmana also stresses the importance of time and the two ahutis of cow-milk to Agni."
20,स यत्सायमस्तमिते द्वेऽआहुती जुहोति । तदेताभ्यां पूर्वाभ्यां पद्भ्यामेतस्मिन्मृत्यौ प्रतितिष्ठत्त्यथ यत्प्रातरनुदिते द्वेऽआहुती जुहोति तदेताभ्यामपराभ्यां पद्भ्यामेतस्मिन्मृत्यौ प्रतितिष्ठति सऽएनमेषऽउद्यन्नेवाऽऽदायोदेति तदेतं मृत्युमतिमुच्यते,Summary: The person giving two offerings in the evening at sunset and in the morning at sunrise - exactly when the sun is rising- is set free from the fear of death .
21,तद्यथेषीकातूलमग्नौ प्रोतं प्रदूयेतैव्ँ हास्य सर्वे पाप्मानः प्रदूयन्ते य एतदेवं विद्वानग्निहोत्रं जुहोति ॥,Chandogya Upanishad clearly lays down the significance of Agnihotra
22,वसन्ति प्राणिनो यत्र ।,"According to Shabdakalpadruma, the word Vastu is described as,"
23,कर्णश्रवेऽनिले रात्रौ दिवा पांसुसमूहने । एतौ वर्षास्वनध्यायावध्यायज्ञाः प्रचक्षते,"It is said that, in the rainy season, the Veda-study must be paused on two occasions - when the wind is audible at night, and when it whirls up the dust in the day-time. ."
24,विद्युत्स्तनितवर्षेषु महोल्कानां च संप्लवे । आकालिकम् अनध्याम् एतेषु मनुरब्रवीत् एतांस्त्वभ्युदितान्विद्याद्यदा प्रादुष्कृताग्निषु । तदा विद्यादनध्यायम् अनृतौ चाभ्रदर्शने,"Manu has stated that when lightning, thunder, and rain are observed, or until there is large fiery meteors falling, the recitation of the Veda must be paused. Also, when one perceives these phenomena in the morning and evening at the time of lighting the sacred fire , during the rainy season, or when clouds appear out of season, then one must know that the recitation of the Veda is to be paused."
25,निर्घाते भूमिचलने ज्योतिषां चोपसर्जने । एतानाकालिकान्विद्यादनध्यायानृतावपि प्रादुष्कृतेष्वग्निषु तु विद्युत्स्तनितनिःस्वने । सज्योतिः स्यादनध्यायः शेषे रात्रौ यथा दिवा,"Also, on crashing sound from the sky, an earthquake and when there is eclipse of the sun or moon, then the Veda-study must be paused until the phenomena lasts; these same phenomena observed during rainy season calls for an indefinite pause in Veda Studies. However, after the sacred fire has been lit, if there is lightning and thunder in the morning then study shall be paused until evening and if the same happens in the evening, the pause shall last as long as the stars are visible in the sky ; And if all above mentioned phenomena occurs together at once, then the reading shall cease both a day and a night. ."
26,नीहारे बाणशब्दे च संध्ययोरेव चोभयोः । अमावास्याचतुर्दश्योः पौर्णमास्यष्टकासु च अमावास्या गुरुं हन्ति शिष्यं हन्ति चतुर्दशी । ब्रह्माष्टकपौर्णमास्यौ तस्मात्ताः परिवर्जयेत्,"One is advised to consider Anadhyayana during fog, while the sound of arrows is audible, during both the morning and evening twilight, on the new-moon day, fourteenth day, full-moon day and the eighth day of each half-month. Because study of the Vedas on new-moon day destroys the teacher and on the fourteenth day destroys the pupil. Reading the Veda on the eighth days makes one forget it and on these specific days, the study of the Vedas is forbid. ."
27,पांसुवर्षे दिशां दाहे गोमायुविरुते तथा । श्वखरोष्ट्रे च रुवति पङ्क्तौ च न पठेद्द्विजः,"One shall not recite the Veda during a dust-storm, nor while the sky is unnaturally red, nor while jackals howl, dogs bark, the donkeys bray or the camels grunt; nor while they are in each other's company."
28,प्रतिगृह्य द्विजो विद्वानेकोद्दिष्टस्य केतनम् । त्र्यहं न कीर्तयेद्ब्रह्म राज्ञो राहोश्च सूतके यावदेकानुदिष्टस्य गन्धो लेपश्च तिष्ठति । विप्रस्य विदुषो देहे तावद्ब्रह्म न कीर्तयेत् प्राणि वा यदि वाप्राणि यत्किं चिच्छ्राद्धिकं भवेत् । तदालभ्याप्यनध्यायः पाण्यास्यो हि द्विजः स्मृतः,"One should not study the Veda for three days, if one has accepted an invitation to a funeral rite in honour of one ancestor , or when the Raja has become impure through a birth or death in his family , or when there is an eclipse of the Sun or the Moon. It is said that as long as the smell and the anointment of Sandalwood given in honour of one ancestor remain on the body, a learned Brahmana, for so long, must not recite the Veda. Be it living or inanimate, having accepted anything at a Shraddha, one should not recite the Veda; for the shastras consider the hand of a Brahmana as mouth. Therefore, accepting is considered as enjoying. ."
29,द्वावेव वर्जयेन्नित्यं अनध्यायौ प्रयत्नतः । स्वाध्यायभूमिं चाशुद्धं आत्मानं चाशुचिं द्विजः,"When the place of Veda recitation is impure, and when oneself is impure, one should surely avoid Veda study. ."
30,नाधीयीताश्वं आरूढो न वृक्षं न च हस्तिनम् । न नावं न खरं नोष्ट्रं नेरिणस्थो न यानगः शयानः प्रौढपादश्च कृत्वा चैवावसक्थिकाम् । नाधीयीतामिषं जग्ध्वा सूतकान्नाद्यं एव च,"One should not recite the Veda when on horseback, tree, elephant, or in a boat, on a donkey, camel, nor on a barren ground, or riding in a carriage. While lying on a bed, while one's feet are raised on a bench, while sitting folding the knee, having eaten meat or food given by a person impure on account of a birth or death in the family, one should not study the Veda. ."
31,चोरैरुपद्रुते ग्रामे संभ्रमे चाग्निकारिते । आकालिकं अनध्यायं विद्यात्सर्वाद्भुतेषु च,"In a village troubled by robbers, during fire accident, or at the time of a wondrous event on the earth or sky, one should avoid the Veda-study until the time the situation lasts. ."
32,उपाकर्मणि चोत्सर्गे त्रिरात्रं क्षेपणं स्मृतम् । अष्टकासु त्वहोरात्रं ऋत्वन्तासु च रात्रिषु,"On the occasion of the Upakarma and of the Vedotsarga, an omission of the Veda-study for three days has been prescribed, while on the Ashtakas and the end of the seasons, Anadhyaya is prescribed for a day and a night. ."
33,न विवादे न कलहे न सेनायां न संगरे । न भुक्तमात्रे नाजीर्णे न वमित्वा न शुक्तके अतिथिं चाननुज्ञाप्य मारुते वाति वा भृशम् । रुधिरे च स्रुते गात्राच्छस्त्रेण च परिक्षते,"Where there is a quarrel, fight, in an army or in a war, while having food, at times of indigestion, having vomited or during the time of birth or death impurities, one should not recite the Veda. Nor should it be done without the permission of a guest, while the winds blow strongly, while blood flows out of one's body, or when hurt by a weapon. ."
34,सामध्वनावृग्यजुषी नाधीयीत कदा चन । वेदस्याधीत्य वाप्यन्तं आरण्यकं अधीत्य च,"One should not recite the Rigveda or the Yajurveda while the Samaveda is being recited; Having completed the Veda and reciting the Aranyaka, one is advised to not read other Vedas for a day and a night. ."
35,विभावसुभरद्राजौ पर्जन्यैरावतौ तथा । विश्वाचीसेनजित्संज्ञौ कार्त्तिके चाधिकारिणाः ।।,Name of a serpent that accompanies Surya in his ratha during the month of Kartika in the Sharat season
36,शेषः प्रथमतो जातो वासुकिस्तदनन्तरम्। ऐरावतस्तक्षकश्च कर्कोटकधनञ्जयौ।।,"Name of an important serpent born to Kashyapa and his wife Kadru . Arjuna's father-in-law, Ulupi's father, Kauravya was a noble serpent born of Airavata. . Shesha was the first born, Vasuki after him, followed by Airavata, Takshaka, Karkotaka and Dhanajaya"
37,दश क्रोधवशा राम विजज्ञे अपि आत्मसंभवाः । मृगीम् च मृगमंदाम् च हरीम् भद्रमदाम् अपि ॥,"Kasyapa, one of the Prajapatis, married the eight daughters of Daksa. One of them named Krodhavasa had ten daughters by Kasyapa."
38,ततो जज्ञे महाकायश्चतुर्दन्तो महागजः। कपिला कामवृक्षश्च कौस्तुभश्चाप्सरोगणः।,"However, we find another story in Mahabharata of how Airavata rose as one of the treasures during samudra- manthan. It is said that when the devas and asuras churned the ocean of Milk, the four tusked, huge elephant also came up along with the other treasures such as Kalpavriksha, Kausthuba and Apsaras."
39,पितृणां धर्मराजं तं यमं राज्येऽभ्यषेचयत् । ऐरावतं गजेन्द्राणाम् अशेषाणां पतिं ददौ ।।,"In the Visnu Purana we are told how Airavata was made the chief of all elephants. When the Maharsis had crowned Prthu as the sovereign King, Brahma gave new posts of honour to many of the devatas."
40,शेषन्तु नागराजानं मृगाणां सिंहमीश्वरम् । वनस्पतीनां राजानं प्लक्षमेवाभ्यषेचयत् ।। ,"Summary: He made Soma the chief of the Stars and Planets, of Brahmins, Yajnas and herbs, Kubera over the rajas; Varuna the master of the seas and all water; Visnu, chief of the Adityas. Along with these Brahma made Yama the chief of pitrs, Airavata of the innumerable elephants; Garuda of the Birds, Indra of the devatas, Ucchaisravas of the horses, Vrshabha of the cattle, Sesha of the serpents, Lion of the beasts and Plaksha of the medicinal trees."
41,यो मामजमनादिं च वेत्ति लोकमहेश्वरम् । असंमूढः स मर्त्येषु सर्वपापैः प्रमुच्यते ॥ ,Nature of the Supreme Being
42,महर्षयः सप्त पूर्वे चत्वारो मनवस्तथा । मद्भावा मानसा जाता येषां लोक इमाः प्रजाः ॥,Saptarshis and 4 Manus
43,एतां विभूतिं योगं च मम यो वेत्ति तत्त्वतः । सोऽविकम्पेन योगेन युज्यते नात्र संशयः ॥,Why should we know of the Supreme Being's Vibhutis?
44,अर्जुन उवाच,Arjuna's Request
45,चातुर्वर्ण्यं मया सृष्टं गुणकर्मविभागशः । तस्य कर्तारमपि मां विद्ध्यकर्तारमव्ययम् ॥,The Bhagavad Gita also says that the division of the society into the four varnas is based on Guna and Karma .
46,एषामुत्पत्त्यादिर्यथा यदा भगवान् पुरुषरूपेण सृष्टिं कृतवान् तदास्यशरीरात् चत्वारो वर्णा उत्पन्नाः मुखतो ब्राह्मणाः बाहुतः क्षत्रियाः ऊरुतो वैश्याः पादतः शूद्रा जाताः,"Talking of the Origin of Varna Concept, Shabdakalpadruma says,"
47,यथा वायुं समाश्रित्य वर्तन्ते सर्वजन्तवः । तथा गृहस्थं आश्रित्य वर्तन्ते सर्व आश्रमाः । यस्मात्त्रयोऽप्याश्रमिणो ज्ञानेनान्नेन चान्वहम् । गृहस्थेनैव धार्यन्ते तस्माज्ज्येष्ठाश्रमो गृही ।,"Grhasthashrama is hailed as the most important, as it carries with it onerous responsibilities of maintaining and sustaining persons belonging to the other three ashramas. Manusmrti says,"
