id,sloka,translation
356,श्रेयःसु गुरुवद्वृत्तिं नित्यं एव समाचरेत् । गुरुपुत्रेषु चार्येषु गुरोश्चैव स्वबन्धुषु । । । । बालः समानजन्मा वा शिष्यो वा यज्ञकर्मणि । अध्यापयन्गुरुसुतो गुरुवन्मानं अर्हति । । । । यथा खनन्खनित्रेण नरो वार्यधिगच्छति । तथा गुरुगतां विद्यां शुश्रूषुरधिगच्छति । । । ।,"Infact, this is ordained as a brahmachari's constant behaviour also towards other gurus imparting knowledge, father and others who are well-wishers saving him from adharma . It says,"
357,तेषां त्रयाणां शुश्रूषा परमं तप उच्यते । । । । त्रिष्वेतेष्वितिकृत्यं हि पुरुषस्य समाप्यते । । । । तयोर्नित्यं प्रियं कुर्यादाचार्यस्य च सर्वदा । तेष्वेव त्रिषु तुष्टेषु तपः सर्वं समाप्यते । । । ।,"The Manusmrti also emphasizes that one who honours one's mother, father and guru is considered to have observed all the dharmas. While, the one who dishonours them, all his dharmas as well as karmas become fruitless."
358,सर्वे तस्यादृता धर्मा यस्यैते त्रय आदृताः । अनादृतास्तु यस्यैते सर्वास्तस्याफलाः क्रियाः । । । ।,"The Manusmrti also emphasizes that one who honours one's mother, father and guru is considered to have observed all the dharmas. While, the one who dishonours them, all his dharmas as well as karmas become fruitless."
359,वर्जयेत्प्रमदागाथामगृहस्थो बृहद्व्रतः । इन्द्रियाणि प्रमाथीनि हरन्त्यपि यतेर्मनः ॥ ॥,"The Bhagavata Purana mentions that a person other than a householder, who has taken the great vow of celibacy, should avoid all talk with young women. For, the senses are so powerful and violent that they carry away the mind of even a Yati who is expected to be perfectly self-controlled."
360,केशप्रसाधनोन्मर्दस्नपनाभ्यञ्जनादिकम् । गुरुस्त्रीभिर्युवतिभिः कारयेन्नात्मनो युवा ॥ ॥ नन्वग्निः प्रमदा नाम घृतकुम्भसमः पुमान् । कल्पयित्वाऽऽत्मना यावदाभासमिदमीश्वरः । द्वैतं तावन्न विरमेत्ततो ह्यस्य विपर्ययः ॥ ॥,"It also specifies that a youthful brahmachari should not allow a personal seva like combing the hair, massaging, bathing and anointing to be done by a woman from his teacher's family, especially if they are young. For, verily a young women is like fire and a man like pot containing clarified butter. Moreover, so long as by self realization one has not firmly determined that his body, senses or the universe etc. are illusory and the jiva has not attained perfect mastery over himself by identifying himself with the Supreme being, the notion of duality will continue to persist through false attribution of gunas."
361,शुश्रूषां सततं कुर्वन्गुरोः संप्रणमेत च। षट्‌कर्मस्वनिवृत्तश्च न प्रवृत्तश्च सर्वशः।। नाचरत्यधिकारेण सेवेत द्विषतो न च। एषोऽऽश्रमपदस्तात ब्रह्मचारिण इष्यते।।,"A brahmachari, as enunciated earlier, is required to always be engrossed in the service of his teacher and offer salutations. And while doing so, the Mahabharata states that he must refrain from the 6 activities viz. performing yajnas for himself or others, learning or teaching, giving or accepting dana and also refrain from engaging in inappropriate activities. It also states that a brahmachari must not exhibit his authority in his behaviour and must avoid the company of those who foster hatred."
362,वर्जयेन्मधु मांसं च गन्धं माल्यं रसान्स्त्रियः । शुक्तानि यानि सर्वाणि प्राणिनां चैव हिंसनम् । । । । अभ्यङ्गं अञ्जनं चाक्ष्णोरुपानच्छत्रधारणम् । कामं क्रोधं च लोभं च नर्तनं गीतवादनम् । । । । द्यूतं च जनवादं च परिवादं तथानृतम् । स्त्रीणां च प्रेक्षणालम्भं उपघातं परस्य च । । । ।,"According to Manusmrti, a brahmachari in the gurukula must abide by the rules with control over his senses in order to increase his tapas . It says,"
363,एकः शयीत सर्वत्र न रेतः स्कन्दयेत्क्व चित् । कामाद्धि स्कन्दयन्रेतो हिनस्ति व्रतं आत्मनः । । । । स्वप्ने सिक्त्वा ब्रह्मचारी द्विजः शुक्रं अकामतः । स्नात्वार्कं अर्चयित्वा त्रिः पुनर्मां इत्यृचं जपेत् । । । ।,"The Manusmrti also adds that a brahmachari must always sleep alone and never give up his veerya. For, the one who gives up his veerya willingly, destroys his vow of brahmacharya. However, if one happens to lose veerya, unwillingly, in dream state then it is advised to bathe, perform worship of the Sun and repeat the rk 'punarmmetvindriyam' thrice."
364,वेदानधीत्य वेदौ वा वेदं वापि यथाक्रमम् । अविप्लुतब्रह्मचर्यो गृहस्थाश्रमं आवसेत् । । । ।,"The period of studentship begins with the Upanaya Samskara and continues until the student, completing in due order, the study of the three Vedas, or two, or one, without transgressing the vow of brahmacharya, enters the grhasthashrama."
365,ब्रह्मवर्चसकामस्य कार्यो विप्रस्य पञ्चमे । राज्ञो बलार्थिनः षष्ठे वैश्यस्येहार्थिनोऽष्टमे । । । ।,"According to Manusmrti and Yajnavalkya Smrti , the Upanayana Samskara should be performed in the 8th year of conception or birth for brahmanas, 11th year for the kshatriyas and 12th year for the Vaishyas or according to one's family custom. And the maximum age to perform the Upanaya for brahmanas, kshatriyas and Vaishyas are 16, 22 and 24 years respectively. The Manusmrti also adds that the Upanayana of brahmanas desirous of attaining brahmavarchas, the splendour of which is beyond the study of Vedas and its meaning, should be performed in the 5th year, of kshatriyas desirous of strength in the 6th year and of Vaishyas desirous of prosperity in the 8th year."
366,प्रतिवेदं ब्रह्मचर्यं द्वादशाब्दानि पञ्च वा । ग्रहणान्तिकं इत्येके केशान्तश्चैव षोडशे । । । ।,"As for the term of Vedadhyayana, the Yajnavalkya Smrti says,"
367,षट्त्रिंशदाब्दिकं चर्यं गुरौ त्रैवेदिकं व्रतम् । तदर्धिकं पादिकं वा ग्रहणान्तिकं एव वा । । । ।,"This very much corelates with the Manusmrti quote that the vow of studying the 3 Vedas under a teacher must be kept for 36 years, or for half that time , or for a quarter , or until the student has perfectly learnt them."
368,तं प्रतीतं स्वधर्मेण ब्रह्मदायहरं पितुः । स्रग्विणं तल्प आसीनं अर्हयेत्प्रथमं गवा । । । ।,"The initiation of a brahmachari into the Grhasthashrama happens when the student, having bathed, with the permission of his teacher, performs, according to the rule, the Samvartana. Samavartana is the rite to be performed at the completion of one's education just before returning home from the preceptor's house. It is said that a brahmachari who has thus become a scholar of Vedas is offered a seat, garland of flowers and is greeted with the 'madhuparka' ritual by the father or guru."
369,न पूर्वं गुरवे किं चिदुपकुर्वीत धर्मवित् । स्नास्यंस्तु गुरुणाज्ञप्तः शक्त्या गुर्वर्थं आहरेत् । । । । क्षेत्रं हिरण्यं गां अश्वं छत्रोपानहं आसनम् । धान्यं शाकं च वासांसि गुरवे प्रीतिं आवहेत् । । । ।,"The student also, at the end of his studentship, offers a present to his preceptor according to his ability, known as Gurudakshina, before returning home to enter the householder's life. The concept of Gurudakshina is highly respected in Bharata's Gurukula tradition. According to Manusmrti, a brahmachari who knows Dharma should not favour his teacher with offerings before learning. However, after Samavartana, he may please his guru with the offerings of field, gold, cow, horse, umbrella, sandals, seat, food, vegetables and clothes as per his ability."
370,दत्त्वा वरमनुज्ञातो गुरोः कामं यदीश्वरः । गृहं वनं वा प्रविशेत्प्रव्रजेत्तत्र वा वसेत् ॥ ॥,And the guru also gives his final instructions to the students through a convocation address at the conclusion of their studentship before sending them home. One such address as recorded in the Taittiriya Upanishad is summarised as follows:
371,चरितब्रह्मचर्यस्य ब्राह्मणस्य विशांपते। भैक्षचर्यास्वधीकारः प्रशस्तो देहमोक्षणे।।,"The Mahabharata states that if the desire for moksha arises in the mind of a brahmana brahmachari who has observed the vow of brahmacharya, he gains the right to take sannyasa after brahmacharyashrama."
372,यदि त्वात्यन्तिकं वासं रोचयेत गुरोः कुले । युक्तः परिचरेदेनं आ शरीरविमोक्षणात् । । । । आचार्ये तु खलु प्रेते गुरुपुत्रे गुणान्विते । गुरुदारे सपिण्डे वा गुरुवद्वृत्तिं आचरेत् । । । । एतेष्वविद्यमानेषु स्थानासनविहारवान् । प्रयुञ्जानोऽग्निशुश्रूषां साधयेद्देहं आत्मनः । । । ।,"Thus, a student is given the opportunity to choose to live his entire life in the teacher's house as a Naishthika Brahmachari. However, with a few instructions. It is said,"
373,नैष्ठिको ब्रह्मचारी तु वसेदाचार्यसंनिधौ । तदभावेऽस्य तनये पत्न्यां वैश्वानरेऽपि वा । । । ।,And the fruit of such diligence is given as freedom from the cycle of birth and death.
374,एवं चरति यो विप्रो ब्रह्मचर्यं अविप्लुतः । स गच्छत्युत्तमस्थानं न चेह जायते पुनः । । । ।,And the fruit of such diligence is given as freedom from the cycle of birth and death.
375,तत्र च सप्त पाकयज्ञसंस्थाः औपासनहोमो वैश्वदेवं पार्वण मष्टका मासिश्राद्धं सर्पबलिं रीशानबलिरिति ।,"The list of seven Pakayajnas according to Apastamba Grhyasutras as elucidated in the commentary of Haradatta, include"
376,यथो एतद्धुतः प्रहुत आहुतश्शूलगवो बलिहरणं प्रत्यवरोहणमष्टकाहोम इति सप्त पाकयज्ञसंस्था इति ।।,"Other versions of Grhyasutras are present. For example: according to Baudhayana Grhya sutras, the Pakayajnas are"
377,आवसथ्याधानं दारकाले दायाद्यकाल एकेषाम् ॥,During vivaha samskara one is initiated to enter the grhasta ashram by setting up the Avasatyaagni to the north of the vedi.
378,कच्चिद् अग्निषु ते युक्तो विधिज्नो मतिमान् ऋजुः हुतम् च होष्यमाणम् च काले वेदयते सदा समिधःपावनाः पूज्याः चर्मयुक्ताः परात्पराः युष्मान् हरामि होमार्थं अस्मान् रक्षत सर्वदा ॥,"Aupasana is to be performed by the grihasthas of the three varnas. Valmiki Ramayana in Ayodhya kanda mentions that Sri Ramachandra, a kshatriya, enquires Bharata about tending the Agni in the house."
379,नाम वा ऋग्वेदो यजुर्वेदः सामवेद अथर्वणश्चतुर्थ इतिहासपुराणः पञ्चमो वेदानां वेदः पित्र्यो राशिदैवो निधिर्वाकोवाक्यमेकायनं देवविद्या ब्रह्मविद्या भूतविद्या क्षत्रविद्या नक्षत्रविद्या सर्पदेवज्ञविद्या नामैवैतन्नामोपास्स्वेति,"Narada maharshi approached Sanatkumara and requested him to teach him Brahmajnana so that he could quieten his disturbed mind. Sanatkumara asks him what knowledge base he already has, so as to accordingly instruct him beyond that knowledge . Towards this end, he asks Narada about all the vidyas that he is aware of."
380,वाग्वाव नाम्नो भूयसी वाग्वा ऋग्वेदं विज्ञापयतु यजुर्वेदँ् सामवेदमाथर्वणं चतुर्थमितिहासपुराणं पञ्चमं वेदानां वाङ्नाभविष्यन्न धर्मो नाधर्मो व्यज्ञापयिष्यन्न सत्यं नानृतं न साधु नासाधु न हृदयज्ञो नाहृदयज्ञो वागेवैतत्सर्वं विज्ञापयति वाचमुपास्स्वेति,"Summary: Vaak is greater than Name. Speech makes one understand the four vedas, the itihasa and puranas, the veda of vedas, the Veda of Vedas namely Vyakarana , Pitrya , Ganita , Daiva , Nidhi , Vakovaakya Ekayana , Deva vidya Brahmavidya Bhutavidya , Kshtravidya , nakshatra vidya , Sarpavidya , heaven, earth, air, akasa, water, fire , the devatas, men, animals, cattle, grasses, trees, worms, and ants, vice and virtue, truth and untruth, good and bad, pleasant and unpleasant. Speech makes us understand all this. Meditate on speech.
 According to Sri. K. S. Narayanacharya's insights"
381,संकल्पो वाव मनसो भूयान्यदा वै संकल्पततेऽथ मनस्यत्यथ वाचमीरयति तामु नाम्नीरयति नाम्नि मन्त्रा एकं भवन्ति मन्त्रेषु कर्माणि,"Summary: Narada rishi continues to ask Sanatkumara questions. Sanatkumar explains: Sankalpa is higher than mind and it is within its purview that we are able to do karma and achieve success. For when a man wills, he thinks in his mind, then through speech he utters it in Name. In the name, the mantras become one, and into the mantras, the karma merges."
382,तानि ह वा एतानि संकल्पैकायनानि संकल्पे प्रतिष्ठितानि सम्क्लृपतां द्यावापृथिवी समकल्पेतां वायुश्चाऽऽकाशं च समकल्पन्ताऽऽपश्च तेजश्च तेषाँ् सम्क्लृप्त्यै संकल्पमुपास्स्वेति,"Summary: Indeed, all these center in the will, consist of will, and abide in will. Dyava,, prithivi and other Panchabhutas , Agni) all of them Willed. Through the will of these, Rain, Food, Prana, mantras, Karma are developed and therefore meditate on Sankalpa. By the will of the world, all things - the whole universe - wills, for an accomplishment of its full form."
383,चित्तं वाव संकल्पाद्भूयो यदा वै चेतयतेऽथ संकल्पयतेऽथ मनस्यत्यथ वाचसीरयति तासु नाम्नीरयति नाम्नि मन्त्रा एकं भवन्ति मन्त्रेषु कर्मणि,"Summary: To Narada maharshi's question Sanatkumara further answered: Chitta is greater than Will. Only when one understands, he will make a resolve, then reflects on his resolve, utters it in speech, spells out the name, and in this the mantras and karma become one."
384,प्राणो ह्योवैतानि सर्वाणि भवति स वा एष एवं पश्यन्नेवं मन्वान एवं विजानन्नतिवादी भवति,"Life-force is verily all these. One who sees thus, thinks, and knows thus, such people are called as ativaadi by general people. An ativaadi only after experiencing the Truth argues for the Truth and should not conceal the fact."
385,अपराबाधमक्लेशं प्रयत्नेनार्जीतं धनम् । स्वल्पं वा विपुलं वापि देयमित्यभिदीयते ॥,A simple definition of Deyam as given by Devala quoted in Chaturvarga Chintamani of Hemadri is
386,सामान्यं पुत्रदाराधिसर्वस्वन्यासयाचितम् । प्रतिश्रुतं तथान्यस्य न देयं त्वष्टधा स्मृतम् ।। ।।कुटुम्बभक्तवसनाद्देयं यदतिरिच्यते । मध्वास्वादो विषं पश्चाद्दातुर्धमोऽन्यथा भवेत् ।। ।।,There are at least nine categories of things which should not be given in charity as described in various smrtis and puranas. Here the idea is
387,भूदीपांश् चान्नवस्त्राम्भस् तिलसर्पिःप्रतिश्रयान् । नैवेशिकं स्वर्णधुर्यं दत्त्वा स्वर्गे महीयते ॥ यास्मृ ॥ गृहधान्याभयोपानच् छत्रमाल्यानुलेपनम् । यानं वृक्षं प्रियं शय्यां दत्त्वात्यन्तं सुखी भवेत् ॥ यास्मृ ॥,"According to this smriti, a person making a gift of land , lamp, wood, garment, water , sesame, ghee, rest house for travellers, money for getting a person married, gold, draught ox, is honoured in the heavenly world. One who makes a gift of a house, corn, protection from danger, shoes, umbrella, flowers, fragrances, conveyance , tree, a desired thing, a cot secures endless happiness."
388,त्रीण्याहुरतिदानानि गावः पृथ्वी सरस्वती । अतिदानं हि दानानां विध्दानं ततोऽधिकम्॥,"Gifts of three things are said to be superior to the gift of anything else, and are styled Atidana, namely of cows, land, and Sarasvati according to Vashishta Dharmasutras."
389,अन्नं दधि मधु त्राणं गोभूरुक्माश्वहस्तिनः । दानान्युत्तमदानानि उत्तमद्रव्यदानतः ॥ विद्यादानादनावासपरिभोगौषधानि च । दानानि मध्यमानीह मध्यद्रव्यदानतः ॥ परिभोग इति परिभोगसाधनं खट्वासनादि । उपानत्प्रेङ्खयानानि छत्रपात्रासनानि च । दीपकाष्ठफलादीनि चरमं बहुवार्षिकम् ॥ बहुत्वादर्थजातानां संख्या शेषेषु नेष्यते ।अधमान्यवशिष्टानि सर्व्वदानान्यती विदुः ॥,"Among the various things classified as Deyam, a different view of Hemadri quoting Devala is as follows:Summary: Food, curds, honey, protection, cow, land, gold, horses and elephants - gifts of these nine are said to be uttama . Vidya , house for unsheltered, domestic household items of comfort , medicines - gifts of these four are said to be of medium level. Shoes, swings, carts, umbrellas, vessals, seat to sit, lamps, wood, fruits, whatever is old and worn out, and all other unspecified objects are inferior."
390,सर्वदानैर्गुरुतरं सर्वगानैर्विशिष्यते । पानीयं नरशार्दूल तस्माद् दातव्यमेव हि॥,"Mahabharata, Anushasana Parva describes jaladana to the thirsty as the greatest of gifts and charity. It instills prana shakti in all and supports life-forms."
391,तस्मात् त्वं सर्वदानानि हित्वान्नं सम्प्रयच्छह न हीदृशं पुण्यफलं विचित्रमिह विद्यते। अन्नमेव विशिष्टं हि तस्मात्परतरं न च॥,"Mahabharata, Vanaparva describes annadana as one which bestows immense punya and is equal to no other gift."
392,अतिदानानि सर्वाणि पृथवीदानमुच्यते । अचला ह्यक्षया भूमिर्दोग्ध्री कामानिहोत्तमान् ॥,"According to Vashishta Dharmasutras Matsya Purana and Mahabharata Anushasana parva , the gift of land, is proclaimed to be the highest of dana."
393,यदङग दाशुषे त्वमग्ने भद्रं करिष्यसि । तवेत् सत्यमङ्गिरः॥ सो अङगिरोभिरङगिरस्तमो भूद वृषा वृषभिः सखिभिः सखा सन् ऋग्मिभिर्ऋग्मी गातुभिर्ज्येष्ठो मरुत्वान नो भवत्विन्द्र ऊती,Angirasa is identified with Agni:
394,तँहाङ्गिरा उद्गीथमुपासांचक्र एतमु एवाऽऽङ्गिरसं मन्यन्तेऽङ्गानां यद्रसः,: Chandogya Upanishad explains as below that because all the limbs of the body are controlled by prana that mukya prana itself has become anga rasa or angirasa.
