id,sloka,translation
274,yatsiddhau anyaprakaraṇasiddhiḥ saḥ adhikaraṇasiddhāntaḥ|| {adhikaraṇasiddhāntalakṣaṇam},That which is the established rule regarding the successful achievement of goals in a different context is itself the criterion for establishing the validity of an argument.
275,yasyārthasya sidhdāvanye'rthā yadadhiṣṭhānāḥ so'dhikaraṇasiddhāntaḥ | yathā dehendriyavyatirikte jñātā darśanasparśanābhyāmekārthagrahaṇādibhiḥ| atrānuṣaṅgiṇo'rthā indriyanānātvaṃ niyataviṣayāṇīndriyāṇi svaviṣayagrahaṇaliṅgāni jñāturjñānasādhanāni gandhādiguṇavyatiriktāṃ dravyaṃ guṇādhikaraṇamaniyataviṣayāścetanā iti pūrvārthasidhdāvete'rthāḥ sidhyanti na tairvinā so 'rthaḥ saṃbhavatīti|,"The owner of the means to establish the purpose (of sensory organs) is he who has established other purposes, as the self is the locus for the senses, known through seeing and touching, etc. In this context, the objects of the senses are not the instruments of knowledge; rather, the senses themselves are the marks of the knower's knowledge. The means to establish the previously mentioned purpose are the senses, which have specific objects and distinct qualities from substances. Thus, these objects of the senses cannot establish that purpose without the senses; it is not possible for that purpose to arise without them."
276,aparīkṣitābhyupagamāttadviśeṣaparīkṣaṇaṃ abhyupagamasiddhāntaḥ|| {abhyupagamasiddhāntalakṣaṇam},You have already established a position based on unanalyzed assumptions and the examination of that very assumption is what needs to be scrutinized.
277,adhaḥ svidāsīt upari svidāsīt bhīriva vindantī |,"Below or above, who has ever found (something) to be fear-inspiring?"
278,pravṛttaṃ ca nivṛttaṃ ca dvividhaṃ karma vaidikam āvartate pravṛttena nivṛttenāśnute'mṛtam,"The Vedic action is of two kinds, performed and not performed; one partakes of immortality by performing and refraining from it."
279,hiṃsraṃ dravyamayaṃ kāmyamagnihotrādyaśāntidam darśaśca pūrṇamāsaśca cāturmāsyaṃ paśuḥ sutaḥ etadiṣṭaṃ pravṛttākhyaṃ hutaṃ prahutameva ca pūrtaṃ surālayārāma kūpā jīvyādilakṣaṇam,"The object of sacrifice is a harmful, desirable, material substance, characterized by the calmness of the agnihotra and other rituals. The new moon and full moon are offerings, as is the animal sacrifice in the four-month sacrificial session. These have been established as the completed rites. O Suralaya, these describe the marks of life, including the wells."
280,naṣṭo mohaḥ smṛtirlabdhā tvatprasādānmayācyuta | sthito'smi gatasandehaḥ kariṣye vacanaṃ tava || ||,"Freed from delusion, I have gained recall, O immutable one, through your grace. Established am I now, with doubts set aside; I will carry out your command."
281,saṃnyāsaḥ karmayogaśca niḥśreyasakarāvubhau | tayostu karmasaṃnyāsātkarmayogo viśiṣyate || ||,"Renunciation and karma-yoga, both lead to liberation; however, between the two, karma-yoga excels in the context of renouncing actions."
282,tapasvibhyo'dhiko yogī jñānibhyo'pi mato'dhikaḥ | karmibhyaścādhiko yogī tasmādyogī bhavārjuna || ||,"Among ascetics, the yogi is considered superior even to the wise; the yogi is also superior to those engaged in fruitive activities. Therefore, O Arjuna, become a yogi."
283,puruṣaḥ sa paraḥ pārtha bhaktyā labhyastvananyayā | yasyāntaḥsthāni bhūtāni yena sarvamidaṃ tatam || ||,"The supreme being, O Partha, is attainable through devotion and no other means. This being resides within all beings and pervades everything in this world."
284,tasmādasaktaḥ satataṃ kāryaṃ karma samācara | asakto hyācarankarma paramāpnoti pūruṣaḥ || ||,"""Therefore, always dedicatedly perform your duty, for only an unattached person attains the highest purpose."""
285,brahmaṇyādhāya karmāṇi saṅgaṃ tyaktvā karoti yaḥ | lipyate na sa pāpena padmapatramivāmbhasā || ||,"The one who performs actions in the field of Brahman, having abandoned attachment, is not tainted by sin, just as a lotus leaf is not tainted by water."
286,oṃ brahmavādino vadanti | kiṃ kāraṇaṃ brahma kutaḥ sma jātā jīvāma kena kva ca sampratiṣṭhā | adhiṣṭhitāḥ kena sukhetareṣu vartāmahe brahmavido vyavasthām || ||,"""Those who speak of Brahman say, 'What is the reason that Brahman existed, lives, and will remain established? Which path do we follow in our living, supported by what power within us? O Jiva, how and where have you steadily established yourself, having been born from what source?' The knowers of Brahman discuss this matter."""
287,kasminnu bhagavo vijñāte sarvamidaṃ vijñātaṃ bhavatīti || ||,"""Bhagavan, only through knowing which (kasmin) is everything (sarvam) known?"""
288,dve vāva brahmaṇo rūpe | mūrtaṃ caivāmūrtaṃ ca martyaṃ cāmṛtaṃ ca | sthitaṃ ca yacca | sacca tyaṃ ca || bṛha ||,"You two, in your forms as the absolute and the manifested, discern the unmanifested, the transient, the immortal, the stationary, and that which is and will be; behold (as) the imperishable."
289,ātmetyevopāsītātra hyete sarva ekaṃ bhavanti |,"These, when taken as 'the self' (ātman), will merge into a single entity."
290,saṃyuktametatkṣaramakṣaraṃ ca vyaktāvyaktaṃ bharate viśvamīśaḥ | anīśaścātmā badhyate bhoktṛbhāvājjñātvā devaṃ mucyate sarvapāśaiḥ || ||,"The Lord, who unites and pervades the manifest and unmanifest kṣara and akṣara in this world, is bound as an ātman, the enjoyer, by becoming the experiencer. But upon knowing the god, one is freed from all bondages."
291,mamaivāṃśo jīvaloke jīvabhūtaḥ sanātanaḥ| manaḥṣaṣṭhānīndriyāṇi prakṛtisthāni karṣati||||,"I, in this world, am an eternal portion of the living being; that immortal portion is struggling to control the six senses (mind, eye, ear, nose, tongue, and skin) that are located in the physical body."
292,na puṇyapāpe mama nāsti nāśo na janma dehendriyabuddhirasti | na bhūmirāpo na ca vahnirasti na cānilo me'sti na cāmbaraṃ ca || || evaṃ viditvā paramātmarūpaṃ guhāśayaṃ niṣkalamadvitīyam | samastasākṣiṃ sadasadvihīnaṃ prayāti śuddhaṃ paramātmarūpam || ||,"There is no destruction of merit or demerit for me, no end to birth, no physical body, senses, or intellect. There is no earth, water, fire, air, or ether for me. I am beyond all this. By understanding the form of the supreme self as an indestructible, singular, all-witnessing consciousness that is beyond being and non-being, one attains purity of self."
293,manorhairaṇyagarbhasya ye marīcyādayaḥ sutāḥ | teṣāṃ ṛṣīṇāṃ sarveṣāṃ putrāḥ pitṛgaṇāḥ smṛtāḥ ṛṣibhyaḥ pitaro jātāḥ pitṛbhyo devamānavāḥ | devebhyastu jagatsarvaṃ caraṃ sthāṇvanupūrvaśaḥ,"Of the progeny of Manorhairaṇyagarbha, beginning with Marići, who are known as the sons of sages, all are considered to be the offspring of the devas. They, having been born from the devas, are remembered as the fathers of humanity. Indeed, they are the origin of this moving and stationary world that came into existence beforehand."
294,vasūnvadanti tu pitṝnrudrāṃścaiva pitāmahān | prapitāmahāṃstathādityānśrutireṣā sanātanī,"The Vasus indeed proclaim the fathers, Rudras too, as well as the grandfathers and great-grandfathers; this eternal tradition is heard."
295,somapā nāma viprāṇāṃ kṣatriyāṇāṃ havirbhujaḥ | vaiśyānāṃ ājyapā nāma śūdrāṇāṃ tu sukālinaḥ somapāstu kaveḥ putrā haviṣmanto'ṅgiraḥsutāḥ | pulastyasyājyapāḥ putrā vasiṣṭhasya sukālinaḥ,"The ones known as somapā are the oblations for the classes of brahmins and kshatriyas, while ājyapā is the name given to the oblation for vaisyas and sukālinah for shudras. The sons of the sage Angira, known for their liberal sacrificial offerings, are somapās. Similarly, Pulastyas's and Vasiṣṭhas's sons are called ājyapās."
296,tasmādapaḥ sambharati tasmāddhiraṇyaṃ sambharati taddyāvāpṛthivyo rasena samardhayati tasmādūṣāntsambharati tasmādākhukarīṣaṃ sambharati,"Therefore, it nourishes the waters from there, similarly enriches the earth with its moisture, and causes the heaven and earth to grow together. It also gathers the herbs and grains from there."
297,kṛttikāsu rohiṇyāṃ mṛgaśirasi phalgunīṣu viśākhayoruttarayoḥ proṣṭhapadayoḥ ||,"At the beginning of Krittikas, Rohini, Mriga Shirish, Phalguni, Vishakha's later parts, and the beginning of Uttara-Phalgunis."
298,kṛttikāsu brāhmaṇa ādadhīta mukhyo brahmavarcasī bhavati || gṛhāṃstasyāgnirdāhuko bhavati ||,"In the Krttikas, a brahmin who studies (this) becomes endowed with the chief radiance of the Brahman; for him, the house becomes a sacrificial fire."
299,kṛttikāsvagnī ādadhīta | etyāhuretadhda vā agnernakṣatraṃ,"In the constellation of Krttikas, two fires have been installed; so they say, referring to the asterism called Agni."
300,vasanto grīṣmo varṣāḥ | te devā ṛtavaḥ śaraddhemantaḥ śiśiraste pitaro ya,"The seasons are Vasanta (spring), Grishma (summer), and Varsha (monsoon); then comes the duo of Sharat (autumn) and Hemant (pre-winter), and finally, the cool one is Shishir."
301,rātriṃ jāgaraṇadhāraṇe śakalairvā,"During the night, (should one) engage in remaining awake with all (the other beings)?"
302,śamīgarbhādagniṃ manthati | eṣā vā agneryajñiyā tanūḥ |,"This is the form of Agni, born from the śamī tree's bark, that gets churned. Indeed, these (forms) are the sacrificial offerings for Agni."
303,sa bhūrbhuva ityetaistribhirakṣarairgārhapatyamādadhāti dve pariśinaṣṭyayātayāmatāyai,"He, with these three syllables ""bhūrbhuva,"" endowed, establishes the sacrificial offering; two are sustained, you all move away, and she becomes bound."
304,yo aśvatthaḥ śamīgarbha āruroha tvesacā | taṃ tvāharāmi brahmaṇā yajñiyaiḥ ketubhiḥ saheti pūrṇāhutyantamagnyādheyaṃ,"The ashvattha tree that has sprung from the seed of shami, I now offer you with oblations in the sacred fire ritual, performed with brahmana's instruments and other accessories, along with this declaration."
305,punarādheyamādhānā'pratijñātasya rājyayaśaskāmasya vā trirātrāvaramagnīnutsṛjya sadyo vā punarvasvoḥ varṣāsu madhyandine vā kuśairādhānam vrīhyapūpamarkapalāśayoḥ pakvaṃ gārhapatyasthāne nidadhātyevamāhamanīyasya yāvaṃ sadyaścet,"Again, of one who has not previously promised to undertake the task, should such a person eager for kingship or pleasure abandon the sacred fire after three nights and prepare, in the middle of the day, using rice, barley, and ripened fruits, an offering on the ritual grounds; I will do the same. This is my vow: I will offer whatever is mine, immediately and as much as there is."
306,viṣṇuranyā devatāsītso'bravīdviṣṇavehīdamā hariṣyāvo yenāyamidamiti sa viṣṇustredhātmānaṃ vi nyadhatta pṛthivyāṃ tṛtīyamantarikṣe tṛtīyaṃ divi tṛtīyamabhiparyāvartāddhyabibhedyatpṛthivyāṃ tṛtīyamāsīttenendro vajramudayacchadviṣṇvanusthitaḥ so'bravītanmā me pra hārasti vā idaṃ,"In response, the sage among the gods, Viṣṇu, declared, ""I will distribute my own self in three parts on earth, in two parts in the atmosphere, and in three parts in heaven. I have already established myself in this way. Just as Indra has emerged with his thunderbolt fully assembled, so Viṣṇu too has established himself. What do you want to take from me or from here?"""
307,mayi vīryaṃ tatte pra dāsyāmīti tadasmai prāyacchattatpratyagṛhṇādadhā meti tadviṣṇaveti prāyacchattadviṣṇuḥ pratyagṛhṇādasmāsvindra indriyaṃ dadhātviti yadantarikṣe tṛtī̭yamāsīttenendro vajramudayacchadviṣṇvanusthitaḥ so'bravīnmā me pra hārasti vā idaṃ,"He promised to grant his power to him who said, ""I will give (this) power to that Viṣṇu who accepts it after taking it back from Indra, and who will make this (power) his own."" And thus Indra, hidden in the atmosphere, took up the thunderbolt. Then he, Viṣṇu, spoke, ""Give me this brilliant weapon."" So, is it for this that you have come, or for something else?"
308,saptadhā tu kṛte garbhe ditiḥ parama duḥkhitā sahasrākṣam durādharṣam vākyam sa anunayā abravīt,"In the womb, sevenfold divided, Diti, extremely distressed, spoke to Sahasraksha, the invincible one, using affectionate words."
309,vāta skaṃdhā ime sapta carantu divi putraka mārutā iti vikhyātā divyarūpā mama ātmajāḥ,"Let these seven breezes, known as the divine and splendid sons of mine, O putraka, roam in the sky; they are my offspring, thus revealed."
310,yadacarastanvā vāvṛdhāno balānīndra prabruvāṇo janeṣu | māyetsā te yāni yuddhānyāhurnādya śatruṃ nanu purā vivitse ||,"When, leading by example and growing in strength, you declare to people the might of others' arms, may those battles not befall you anew. Have you not already conquered your enemy in the past?"
311,śateṣu jāyate śūraḥ sahasreṣu ca paṇḍitaḥ | vaktā śatasahasreṣu dātā bhavati vā na vā ||,"In twenties, a hero is born, among thousands a scholar; in hundreds, one becomes a speaker, or perhaps not, and a giver too."
312,kuṭumbabharaṇāddravyaṃ yatkiṃcidatiricyate | taddeyaṃ upahṛtyānyaddadaddoṣaṃ avāpnuyāt | | | |,"Whatever material object, beyond what is necessary for maintaining the household, is acquired, by taking that as to be given, one does not incur fault."
313,śaktaḥ parajane dātā svajane duḥkhajīvini | madhvāpāto viṣāsvādaḥ sa dharmapratirūpakaḥ | |,"Capable of giving in foreign lands, but living miserably in one's own, consuming poison and enjoying sweet substances – such a person is the embodiment of dharma."
314,tatra guṇānsamīkṣya yathāśakti deyam,"There, considering the qualities, one should give as much as one can."
315,indriyaprītyarthasya tu bhikṣaṇamanimittam | na tadādriyeta ::: yoktā ca dharmayukteṣu dravyaparigraheṣu ca ::: pratipādayitā ca tīrthe :::,"The purpose of begging for the enjoyment of the senses is only a means, not an end in itself. One should not become attached to it. Moreover, one who is established in dharma should give away wealth at holy places."
316,yantā cātīrthe yato na bhayaṃ syāt ::: saṃgrahītā ca manuṣyān :::,Where one can travel to the sacred river without fear and is able to gather people.
317,deśataḥ kālataḥ śaucataḥ samyak pratigrahītṛta iti dānāni pratipādayati :::,"He lays down (pratipadyati) that gifts should be given after considering the proper time (kalatah), place (desatah), and purity (shaucatah) and when one is fully equipped to accept (pratigrahitrita iti) them."
318,yadyasya vihitaṃ carma yat sūtraṃ yā ca mekhalā | yo daṇḍo yacca vasanaṃ tattadasya vrateṣvapi || sevetemāṃstu niyamān brahmacārī gurau vasan | sanniyamyendriyagrāmaṃ tapovṛddhyarthamātmanaḥ ||,"If one is ordained to wear this leather strap, that thread, and she the belt, and he the staff, and those the garments, they should observe this discipline as a brahmachari under their guru. Restraining their senses' assembly, they should don these for spiritual growth."
319,mekhalādhāraṇabhaikṣacaryadaṇḍasamidādhānopasparśanaprātarabhivādā nityam,"Performing the daily acts of respectfully greeting and touching the ascetic's staff, after having assumed the bark garment and alms bowl, is my constant practice."
320,brahma vedastadadhyayanārthaṃ yadvrataṃ tadapi brahmataccaratīti brahmacārī |,"A pursuer of brahmic studies should engage in that vow, which is for the purpose of studying the Veda. That is what is meant by a brahmacari."
321,mekhalājinavāsāṃsi jaṭādaṇḍakamaṇḍalūn | bibhṛyādupavītaṃ ca darbhapāṇiryathoditam || ||,"Should one wear the sacred thread, knotted hair, and carry a water pot, all adorned with marks of asceticism? The hands, holding darbha grass, should also be carried in such a way."
322,daṇḍājinopavītāni mekhalāṃ caiva dhārayet |,"He should cause to wear the sacred thread, Ājina, and the belt, Mekhalā."
323,muñjānāṃ valkalānāntu kramānmaujjyāḥ prakīrtitāḥ || mārgavaiyādhravāstāni carmāṇi vratacāriṇāṃ | parṇapippalavilvānāṃ kramāddaṇḍāḥ prakīrtitāḥ ||,"Of the kusa grass and bark cloth, their progressive uses are renowned; for ascetics who follow vows, the staffs of the trees described come sequentially."
324,kārṣṇarauravabāstāni carmāṇi brahmacāriṇaḥ | vasīrannānupūrvyeṇa śāṇakṣaumāvikāni ca | | | |,"""Let the brahmacharis (celibate students) wear, in the traditional way, leather garments and those made of bark and animal hair."""
325,aiṇeyamajinamuttarīyaṃ brāhmaṇasya rauravaṃ rājanyasya ājaṃ gavyaṃ vā vaiśyasya sarveṣāṃ vā gavyamasati pradhānatvāt,"The object to be pursued by a brahmin is his debtless state, the object to be pursued by a king is the acquisition of a kingdom, for a cow or any property is most prominent among them all."
326,avakrāḥ satvacaḥ sarve nāvipluṣṭāstu daṇḍakāḥ ||,All the trees in Dandaka forest are upright and not tampered with.
327,kauśaṃ sautraṃ vā tristrivṛd yajñopavītam || ā nābheḥ ||,"A sacred thread, whether made of Kusha grass or simply woven, is threefold when ritually tied around the waist."
328,kārpāsaṃ upavītaṃ syādviprasyordhvavṛtaṃ trivṛt | śaṇasūtramayaṃ rājño vaiśyasyāvikasautrikam | | | | vāsopavīte kārpāsakṣaumorṇānāṃ yathākramaṃ |,"The sacred thread should be a cotton one, worn by the brahmin with its upper end un twisted and made up of three threads. Similarly, for a merchant, his untwisted sacred thread should be woven from silk threads, two in number, arranged in proper order."
329,mekhalāṃ ajinaṃ daṇḍaṃ upavītaṃ kamaṇḍalum | apsu prāsya vinaṣṭāni gṛhṇītānyāni mantravat | | | |,"With mantras, one should cause (their) worn-out clothes, deer skin, staff, sacred thread, and water vessel to be taken up from water, as if grasping them anew."
330,upanīya guruḥ śiṣyaṃ sikṣayecchaucamāditaḥ | ācāramagnikāryaṃ ca sandhyopāsanameva ca ||,"Having approached, the teacher should instruct the disciple, eager to learn, on conduct, duties, and sandhyUpāsanam."
331,snānaṃ abdaivatairmantrairmārjanaṃ prāṇasaṃyamaḥ | sūryasya cāpyupasthānaṃ gāyatryāḥ pratyahaṃ japaḥ | | | |,"Ritual purification with divine mantras, the daily discipline of controlling the vital breaths, attending to the sun, and reciting Gayatri each morning."
332,nityaṃ snātvā śuciḥ kuryāddevarṣipitṛtarpaṇam | devatābhyarcanaṃ caiva samidādhānaṃ eva ca | | | |,"Always bathed and remaining pure, one should offer tarpaṇa to devarṣi-pitṛs, perform devatā worship and samidādhana."
333,sāyaṃ prātarupāsīta gurvagnyarkasurottamān | ubhe sandhye ca yatavāgjapan brahma samāhitaḥ || ||,"In the morning and evening, one should revere the best among teachers, fire gods, sun, and surgeons; being established in focus, they should recite the sacred syllable ""brahma"" while engaged in chanting."
334,sāyaṃ prātaśca juhuyānnāmedhyaṃ vyastahastakaṃ | dūrādāhṛtya samidhaḥ sannidadhyādvihāyasi | sāyaṃḥ prātaśca juhuyāttābhiragniṃ atandritaḥ | | | |,"In the evening and in the morning, one should offer oblations, having properly prepared the fire altar and gathered the firewood from a distance. With an unwavering mind, one should continuously worship the ever-shining fire."
335,chandāṃsyadhīyīta gurorāhūtaścetsuyantritaḥ | upakrame'vasāne ca caraṇau śirasā namet || ||,"Should be learned by heart, (one) invited by the teacher, and controlled, at the beginning and end, the chants, with feet touching (the ground) and head bowing down in reverence."
336,codito guruṇā nityaṃ apracodita eva vā | kuryādadhyayane yatnaṃ ācāryasya hiteṣu ca | | | |,"Should a student, taught by the teacher or left to himself, always put in effort in studying and serving the teacher's interests as well."
337,yajñānāṃ tapasāṃ caiva śubhānāṃ caiva karmaṇām | veda eva dvijātīnāṃ niḥśreyasakaraḥ paraḥ | | | |,"Of all sacrificial acts, austerities, and auspicious deeds, the Veda is indeed the ultimate source of upliftment for the twice-born."
338,vedaṃ eva sadābhyasyettapastapsyandvijottamaḥ | vedābhyāso hi viprasya tapaḥ paraṃ ihocyate | | | |,"The twice-born of superior quality should study the Vedas daily, for the constant study of the Vedas is said to be the supreme austerity for the brahmin ."
339,madhunā payasā caiva sa devāṃstarpayeddvijaḥ | pitṝnmadhughṛtābhyāṃ ca ṛco'dhīte ca yo'nvaham | | | | yajūṃṣi śaktito'dhīte yo'nvahaṃ sa ghṛtāmṛtaiḥ | prīṇāti devānājyena madhunā ca pitṝṃstathā | | | | sa tu somaghṛtairdevāṃstarpayedyo'nvahaṃ paṭhet | sāmāni tṛptiṃ kuryācca pitṝṇāṃ madhusarpiṣā | | | | medasā tarpayeddevānatharvāṅgirasaḥ paṭhan | pitṝṃśca madhusarpirbhyāṃ anvahaṃ śaktito dvijaḥ | | | | vākovākyaṃ purāṇaṃ ca nārāśaṃsīśca gāthikāḥ | itihāsāṃstathā vidyāḥ śaktyādhīte hi yo'nvaham | | | | māṃsakṣīraudanamadhu tarpaṇaṃ sa divaukasām | karoti tṛptiṃ kuryācca pitṝṇāṃ madhusarpiṣā | | | |,"A twice-born, desiring to satisfy the gods with ghee and milk, and their ancestors with offerings made from ghee and honey, is capable of performing rituals during the recitation of the ṛk verses. The one who, every day, delights the gods with the soma ritual using ghee, satisfies his ancestors with a mixture of honey and curds, and nourishes the gods with the offering made from the fat of animals and curds. He who is capable, should perform the rituals prescribed in the ātharvaṇa texts for satisfying the ancestors with offerings of honey and curds. One should satisfy the gods and ancestors with oblations of ghee, milk, and curds as well as with the recitation of ancient sayings and gāthikī verses. He who is capable, should perform the rituals for satisfying the gods and ancestors using oblations made from meat, rice porridge, and curds."
340,yaṃ yaṃ kratuṃ adhīte ca tasya tasyāpnuyātphalam | | | |,"Whichever ritual he studies, he will attain its corresponding reward."
341,trirvittapūrṇapṛthivī dānasya phalaṃ aśnute | tapasaśca parasyeha nityaṃ svādhyāyavāndvijaḥ | | | |,"Three times having been endowed with riches and fully accomplished, a land sees the fruit of giving; similarly, constantly, O learned Brahmin, through self-study is the reward for asceticism."
342,bhaikṣeṇa vartayennityaṃ naikānnādī bhavedvratī | bhaikṣeṇa vratino vṛttirupavāsasamā smṛtā | | | |,Should a person always be engaged in begging as their occupation? Such a one who observes this vow of begging should be considered comparable to a partial fast.
343,brāhmaṇeṣu caredbhaikṣaṃ anindyeṣvātmavṛttaye | | | |,"Let a brahmina in the society partake alms from pure, uncondemned and upright individuals with a self-controlled nature."
344,prathamaṃ tatra bhhikṣeta yatra bhikṣā dhruvaṃ bhavet |,"There, he should first beg for alms where they are certainly available."
345,mātaraṃ vā svasāraṃ vā māturvā bhaginīṃ nijām | bhikṣeta bhikṣāṃ prathamaṃ yā cainaṃ nāvamānayet | | | |,"He should first approach his mother or sister, or a relative of his mother, seeking alms - whoever she may be - and not slight her."
346,sāyaṃ prātaścaredbhaikṣaṃ gurave tannivedayet | bhuñjīta yadyanujñāto no cedupavasetkvacit || ||,"In the evening and at dawn, let him beg for alms and inform his teacher about it. Let him eat what has been permitted; otherwise, let him not sit down (to eat) at any time."
347,vratavaddevadaivatye pitrye karmaṇyatha rṣivat | kāmaṃ abhyarthito'śnīyādvrataṃ asya na lupyate | | | | brāhmaṇasyaiva karmaitadupadiṣṭaṃ manīṣibhiḥ | rājanyavaiśyayostvevaṃ naitatkarma vidhīyate | | | |,"Like the rishis, one should perform the duties in pitry Karma as laid down in the scriptures, just as the vow to a deity is not broken. If requested, the brahmana should partake food, his vow remaining unbroken. This duty has been ordained specifically for the brahmanas and not for rajanyas and vaishyas."
348,vedayajñairahīnānāṃ praśastānāṃ svakarmasu | brahmacāryāharedbhaikṣaṃ gṛhebhyaḥ prayato'nvaham | | | | guroḥ kule na bhikṣeta na jñātikulabandhuṣu | alābhe tvanyagehānāṃ pūrvaṃ pūrvaṃ vivarjayet | | | | sarvaṃ vāpi caredgrāmaṃ pūrvoktānāṃ asaṃbhave | niyamya prayato vācaṃ abhiśastāṃstu varjayet | | | |,"O virtuous one, should a brahmachari in their own duties take alms from the teacher's family or relatives. If not available there, then he should first reject (the option of) other houses. He should meticulously follow all (prescribed) duties in the village. If not possible, even the entire village should be carefully avoided. After regulating his speech, he should reject harsh words."
