id,sloka,translation
538.0,tatḥ sadarpaṃ pratanuṃ tapasyayā madasrutikṣāmamivaikavāraṇam | parijvalantaṃ nidhanāya bhūbhṛtāṃ dahantamāśā iva jātavedasam ||,"With undivided attention, I will ignite the sacrificial fire, resembling a solitary raincloud that dispels the world's scorching heat for all creatures, blazing brightly, prepared to consume its fuel, similar to fire-god Agni himself."
539.0,anādaropāttadhṛtaikasāyakaṃ jaye'nukūle suhṛdīva saspṛham | śanairapūrṇapratikārapelave niveśayantaṃ nayane balodadhau ||,"Wielding a single weapon, acquired in a manner free of disrespect,
He, gracefully and carefully taking it up, skillfully settles it
In the open eye of battle, as a strong man would his weapon,
Friendly yet slightly distant, he skillfully sets it in motion,
Like a skilled archer, in the heat of conflict."
540.0,niṣaṇṇamāpatpratikārakāraṇe śarāsane dhairya ivānapāyini | alaṅghanīyaṃ prakṛtāvapi sthitaṃ nivātaniṣkampamivāpagāpatim  ||,"Like an arrow ready for discharge on the battlefield, poised to counter an attack, yet steadfast and unwavering like a fixed pillar, remaining unmoved even by natural calamities such as wind, such is its patient endurance that has been established; it is also worthy of respect and is as steady as nature itself."
541.0,upeyuṣīṃ bibhratamantakadyutiṃ vadhādadūre patitasya daṃṣṭriṇaḥ | puraḥ samāveśitasatpaśuṃ dvijaiḥ patiṃ paśūnāmiva hūtamadhvare ||,"Approaching while bearing a radiance akin to the destroyer's, with his fangs bared, lying at a distance from the sacrificial ritual, the beast has been tamed by the twice-born, just as they would tame their own domestic animals, having been subdued."
542.0,nijena nītaṃ vijitānyagauravaṃ gabhīratāṃ dhairyaguṇena bhūyasā | vanodayeneva ghanoruvīrudhā samandhakārīkṛtamuttamācalam ||,"With her own action, she has vanquished others' arrogance; with superior courage, she has elevated herself, just like a cloud swelling with rain. Just as a dense, dark cloud brings forth a shining peak, so she has made her exalted position manifest."
543.0,maharṣabhaskandhamanūnakaṃdharaṃ bṛhacchilāvapraghanena vakṣasā | samujjihīrṣuṃ jagatīṃ mahābharāṃ mahāvarāhaṃ mahato'rṇavādiva ||,"With his broad chest swelling like a great ocean, the mighty-bull among sages, Manu, uses his immense strength to lift the mountain resting on Kandharma, eager to cast off the immense burden of the earth."
544.0,gurukriyārambhaphalairalaṃkṛtaṃ gatiṃ pratāpasya jagatpramāthinaḥ | gaṇāḥ samāseduranīlavājinaṃ tapātyaye toyaghanā ghanā iva ||,"The groups of sages approached and assembled around the noble one among men, adorned by the results of his student rituals, like dark clouds gathering at the start of his severe penance for the welfare of the world."
545.0,yathāsvamāśaṃsitavikramāḥ purā muniprabhāvakṣatatejasaḥ pare | yayuḥ kṣaṇādapratipattimūḍhatāṃ mahānubhāvaḥ pratihanti pauruṣam ||,"Just as the greatness of the self-controlled sage, previously endowed with his own control and might, waned in a moment by the powerful prowess; so does magnificent power swiftly counteract meager strength."
546.0,tataḥ prajahve samameva tatra tairapekṣitānyonyabalopapattibhiḥ | mahodayānāmapi saṅghavṛttitāṃ sahāyasādhyāḥ pradiśanti siddhayaḥ ||,"Then, at the sacrificial ceremony, those accomplished ones among themselves, through fair assessment of each other's abilities, point out the feasible aids for even the emergence of great powers, as well as the appropriate courses of action; they do so as they are capable of achieving success in their endeavors."
547.0,kirātasainyādurucāpanoditāḥ samaṃ samutpeturupāttaraṃhasaḥ | mahāvanādunmanasaḥ khagā iva pravṛttapatradhvanayaḥ śilīmukhāḥ ||,"The Kirata troops, roused by a certain entity referred to as Uru, emit a massive sound equally potent, as if they were birds taking flight all at once, setting out on their respective predetermined paths."
548.0,gabhīrarandhreṣu bhṛśaṃ mahībhṛtaḥ pratisvanairunnamitena sānuṣu | dhanurninādena javādupeyuṣā vibhidyamānā iva dadhvanurdiśaḥ ||,"In the deeply hidden recesses, you, as the holder of the earth, are being pierced all around by the sharp sound of the bowstring, just as if advancing in battle; brandishing your weapon , you make a sound like thunder , thus stirring up the directions ."
549.0,vidhūnayantī gahanāni bhūruhāṃ tirohitopāntanabhodigantarā | mahīyasī vṛṣṭirivānileritā ravaṃ vitene gaṇamārgaṇāvaliḥ ||,"The gust of wind drives away the thick clouds enshrouding the quarters, just as a heavy rainstorm expels the cloud cover. It does so by flowing and expanding, making way through the dense clouds that have arisen."
550.0,trayīmṛtūnāmanilāśinaḥ sataḥ prayāti poṣaṃ vapuṣi prahṛṣyataḥ | raṇāya jiṣṇorvidupeva satvaraṃ ghanatvamīye śithilena varmaṇā ||,"Indeed, for the one who takes delight in the nectar of the three Vedas, his nourishment and strength grow firm, just as a sharpened weapon does in the grasp of a resolute and skillful warrior."
551.0,patatsu śastreṣu vitatya rodasī samantatastasya dhanurdudhūṣataḥ | saroṣamulkeva papāta bhīṣaṇā baleṣu dṛṣṭirvinipātaśaṃsinī ||,"The terrifying sight, comparable to a fiery meteor falling, having stretched its bowstring in all directions among the weapons, fell in that battle. The weapons laid out there served as the background against which this striking sight unfolded, as the string of the bow was stretched out in every direction. The sight itself was formidable, inspiring awe and fear, much like a fiery meteor plummeting through the sky."
552.0,diśaḥ samūhanniva vikṣipanniva prabhāṃ raverākulayannivānilam | muniścacāla kṣayakāladāruṇaḥkṣitiṃ saśailāṃ calayanniveṣubhiḥ ||,"Like a gathering of stars scattered and a sun darkened, a sage is being tossed about, made cruel by the relentless advance of time, shaking the stability of the crowned mountain."
553.0,vimuktamāśaṃsitaśatrunirjayairanekamekāvasaraṃ vanecaraiḥ | sa nirjaghānāyudhamantarā śaraiḥ kriyāphalaṃ kāla ivātipātitaḥ  ||,"Having been freed from enemies, praised by many victors in a unique opportunity, that person, as time itself, surpasses the fruit of actions, leaving behind weaponless adversaries."
554.0,gataiḥ pareṣāmavibhāvanīyatāṃ nivārayadbhirvipadaṃ vidūragaiḥ | bhṛśaṃ babhūvopacito vṛhatphalaiḥ śarairupāyairiva pāṇḍunandanaḥ ||,"Warded off by the expertly aimed missiles of those in the distant past, Pandu's son has been greatly adorned with an abundance of immense fruit; indeed who in this world, through their own efforts, can surpass him in virtue and valor?"
555.0,divaḥ pṛthivyāḥ kakubhāṃ nu maṇḍalātpatanti vimbāduta tigmatejasaḥ | sakṛdvikṛṣṭādatha kārmukānmuneḥ śarāḥ śarīrāditi te'bhimenire  ||,"From the solar and lunar orbits, heated raindrops are falling onto the earth's surface. Just like expertly released arrows from a sage's bow, they penetrate the physical bodies, becoming two within one."
556.0,gaṇādhipānāmavidhāya nirgataiḥ parāsutāṃ marmavidāraṇairapi | javādatīye himavānadhomukhaiḥ kṛtāparādhairiva tasya patribhiḥ ||,"Even the mighty Himalayas, as if culpable by the extraction of hidden gems, reveal their peaks, analogous to one who has committed transgressions. This is because of the rulers' assembly causing those who have left and specialized in gem extraction . Similarly, the present participle 'datīye' indicates that the Himalayas, personified as a male , open their mouths ."
557.0,dviṣāṃ kṣatīryāḥ prathame śilīmukhā vibhidya dehāvaraṇāni cakrire | na tāsu pete viśikhaiḥ punarmuneraruṃtudatvaṃ mahatāṃ hyagocaraḥ ||,"For the cruel ones, in the very beginning, they pierced through the protective coverings of the bodies with sharp arrows, but even after being pierced by those arrows, a decrease in their great power did not occur in them."
558.0,samujjhitā yāvadarāti niryatī sahaiva cāpānmunibāṇasaṃhatiḥ | prabhā himāṃśoriva paṅkajāvaliṃ nināya saṃkocamumāpateścamūm ||,"As long as the risen moon has not yet set, it keeps illuminating together with its accompanying 'star-arrows' (i.e., stars), just like a garland adorned with flashes of lightning along with expanding clouds; in a similar way, Umā's consort, the commander-in-chief, withdraws his army."
559.0,ajihmamojiṣṭhamamoghamaklamaṃ kriyāsu bahvīṣu pṛthaṅgiyojitam | prasehire sādayituṃ na sāditāḥ śaraughamutsāhamivāssa vidviṣaḥ  ||,"Even those who are proficient in multiple endeavors, united with the foremost one, are unable to satisfy those filled with hostility, similar to the futile attempt of making a cloud of dust settle during a gust of wind."
560.0,śivadhvajinyaḥ pratiyodhamagrataḥ sphurantamugreṣumayūkhamālinam | tamekadeśasthamanekadeśagā nidadhyurarkaṃ yugapatprajā iva ||,"Adorning a banner marked with the Shiva emblem, a resplendent figure, wielding a spear and adorned with garlands, is simultaneously fixed in the sky by the diverse populations of various regions, as if they were giving birth to the sun."
561.0,muneḥ śaraugheṇa tadugraraṃhasā balaṃ prakopādiva viṣvagāyatā | vidhūnitaṃ bhrāntimiyāya saṅginīṃ mahānileneva nidāghajaṃ rajaḥ  ||,"Like a great cloud driven away by the forceful gust of a sage's anger, what strength, having been dispersed, can still persist, spreading everywhere, posed to delude the ignorant one?"
562.0,tapobalenaiṣa vidhāya bhūyasīstanūradṛśyāḥ svidiṣūnnirasyati | amuṣya māyāvihataṃ vihanti naḥ pratīpamāgatya kimu svamāyudham  ||,"By exerting oneself in austerity and gaining strength , how can one make this hidden, faded form that has become inconspicuous become prominent again ? Having overcome this deceptive illusion of his, what weapon can protect us ?"
563.0,hṛtā guṇairasya bhayena vā munestirohitāḥ svitpraharanti devatāḥ | kathaṃ nvamī saṃtatamasya sāyakā bhavantyaneke jaladherivormayaḥ ||,"With his qualities stolen by fear, are the sage's enemies truly the celestial beings? Or, as if they were waves on a disturbed body of water, do they merely appear to be so?"
564.0,jayena kaccidviramedayaṃ raṇādbhavedapi svasti carācarāya vā | tatāpa kīrṇā nṛpasūnumārgaṇairiti pratarkākulitā patākinī ||,"With what victory might one ever ensure the well-being of all beings, moving and non-moving, in this battlefield that is now filled with the confusion caused by opposing viewpoints, even after subduing the king's son through force?"
565.0,amarṣiṇā kṛtyamiva kṣamāśrayaṃ madoddhateneva hitaṃ priyaṃ vacaḥ | balīyasā tadvidhineva pauruṣaṃ balaṃ nirastaṃ na rarāja jiṣṇunā ||,"With forbearance akin to a duty, the respected one took shelter, as if having been uplifted by me; thus, spoken words became more powerful, dispelling the ordinary strength in that manner. The extraordinary masculine power was destroyed, and the conqueror did not shine."
566.0,pratidiśaṃ plavagādhipalakṣmaṇā viśikhasaṃhatitāpitamūrtibhiḥ | ravikaraglapitairiva vāribhiḥ śivabalaiḥ parimaṇḍalatādadhe ||,"Facing all directions, Lakshmana, the chief of monkeys, has assembled and energized his formidable strength, similar to how the sun's rays gather and radiate their powerful brilliance."
567.0,pravitataśarajālacchannaviśvāntarāle vidhuvati dhanurāvirmaṇḍalaṃ pāṇḍusūnau | kathamapi jayalakṣmīrbhītabhītā vihātuṃ viṣamanayanasenāpakṣapātaṃ viṣehe ||,"Even in the secluded expanse of the world, concealed by the scattering mists of a rain shower, how could the steadfast aim of Pandu's son endure any disturbance, as Indra's wife, stricken with fear, tries to flee in the midst of the uneven battlefield?"
568.0,atha bhūtāni vārtraghnaśarebhyastatra tatrasuḥ | bheje diśaḥ parityaktamaheṣvāsā ca sā camūḥ ||,"Then, the creatures, vanquishers of the calamity, here and there, having discarded their weapons, along with their great bows and troops, as well as their eagerness for battle, did so."
569.0,apaśyadbhiriveśānaṃ raṇānnivavṛte gaṇaiḥ | muhyatyeva hi kṛcchreṣu saṃbhramajvalitaṃ manaḥ ||,"Witnessing the lord being enveloped by troops in battle, the mind gets agitated in critical situations, as if getting bewildered in difficult circumstances, having been set ablaze."
570.0,khaṇḍitāśaṃsayā teṣāṃ parāṅmukhatayā tayā | āviveśa kṛpā ketauṃ kṛtoccairvānaraṃ naram ||,"With the elimination of their fears by her, turning toward him, the flag of mercy, Kṛta, fully equipped with loud sounds, approached and entered the human in the form of a monkey."
571.0,āsthāmālambya nīteṣu vaśaṃ kṣudrevarātiṣu | vyaktimāyāti mahatāṃ māhātmyamanukampayā ||,"By firmly establishing himself, he gains authority over petty yet hard-to-manage individuals in"
572.0,sa sāsiḥ sāsusūḥ sāso yeyāyeyāyayāyayaḥ | lalau līlāṃ lalo'lolaḥ śaśīśaśiśuśīḥ śaśan ||,"He, as husband, endured; as father, nurtured him; as son, honored him; as relative, shared with them; as protector, ensured their safety; as lover, frolicked with her; as friend, delighted in their company; as guru, imparted knowledge; as a boy, he studied; as the moon, he shines."
573.0,trāsajihmaṃ yataścaitānmandamevānvitāya saḥ | nātipīḍayituṃ bhagnānicchanti hi mahaujasaḥ ||,"Even these naturally fierce ones make efforts to avoid excessively distressing those who have been subdued , as they wish to not afflict them. This is because they understand that such behavior is consistent with their great power ."
574.0,athāgre hasatā sācisthitena sthirakīrtinā | senānyā te jagadire kiṃcidāyastacetasā ||,"Now, standing firm at the forefront, praised for your steadfastness, what can armies of this world do for you, with your mind so absorbed?"
575.0,mā vihāsiṣṭa samaraṃ samarantavyasaṃyataḥ | kṣataṃ kṣuṇṇāsuragaṇairagaṇairiva kiṃ yaśaḥ ||,"Why would a self-controlled warrior, prepared for an impending battle, care for mere fame when compared to being surrounded by an army of defeated and destroyed demonic hordes?"
576.0,vivasvadaṃśusaṃśleṣadviguṇīkṛtatejasaḥ | amī vo moghamudgūrṇā hasantīva mahāsayaḥ ||,"Worshipped twofold, having amplified the radiance of Vivasvan, these magnanimous souls laugh, as if they are unsuccessful or pointless."
577.0,vane'vane vanasadāṃ mārgaṃ mārgamupeyuṣām | bāṇairbāṇaiḥ māsaktaṃ śaṅke'śaṃ kena śāmyati ||,"In two adjacent forests, where ascetics follow their respective paths, how does one appease the fear of being pierced by each other's arrows?"
578.0,pātitottaṅgamāhātmyaiḥ saṃhṛtāyatakīrtibhiḥ | gurvīṃ kāmāpadaṃ hantuṃ kṛtamāvṛttisāhasam ||,"By harnessing the immense glory derived from taming overpowering waves and with a monumental effort, the destructive downfall of worldly desires has been successfully overcome."
579.0,nāsuro'yaṃ na vā nāgo dharasaṃstho na rākṣasaḥ | nā sukho'yaṃ navābhogo raṇistho hi rājasaḥ ||,"This is not an demon, nor a snake, nor one steadfast on a mountain, nor a ghost. Nor is there ease or fresh renunciation for a king engaged in battle, indeed."
580.0,mandamasyanniṣulatāṃ ghṛṇayā munireṣa vaḥ | praṇudatyāgatāvajñaṃ jaghaneṣu paśūniva ||,"With a disdainful glance, this sage *renders insignificant* the ignorance of those who, unaware of his true nature, belittle him, just as a butcher trivializes the lives of animals."
581.0,na nonanunno nunnono nānā nānānanā nanu | nunno'nunno nanunneno nānenā nunnanunnanut ||,"Not a single one, not diminished in itself, nor diminishing others, diverse in forms and nature; neither incomplete in any way nor exceeding limits."
582.0,varaṃ kṛtadhvastaguṇādatyantamaguṇaḥ pumān | prakṛtyā hyamaṇiḥ śreyānnālaṃkāraścyutopalaḥ ||,"The foremost among men is he whose virtues, destroyed at the very extreme, is himself devoid of qualities, resembling a polished gem by nature. Indeed, such a person, having transcended the need for ornamentation or external displays of merit, is truly superior."
583.0,syandanā no caturagāḥ surebhā vāvipattayaḥ | syandanā no ca turagāḥ surebhā vā vipattayaḥ ||,"Not only are our four-footed horses, characterized by their attractiveness, but our two-footed steeds (warriors) as well, noted for their attractiveness, are skilled in averting mishaps."
584.0,bhavadbhiradhunārātiparihāpitapauruṣaiḥ | hṛdairivārkaniṣpītaiḥ prāptaḥ paṅko duruttaraḥ ||,"Acquired with great effort by you all, and made accessible, is this hard-to-reach mud, warmed by the sun-like hearts."
585.0,vetraśākakuje śaile'leśaije'kukaśātrave | yāta kiṃ vidiśo jetuṃ tuñjaśo divi kiṃtayā ||,"Having set out, where should you go, in the region of Śāka on the isolated hill, in the battle against Kuku-śātru, what is there to achieve in a foreign land or in the sky, while being indifferent?"
586.0,ayaṃ vaḥ klaibyamāpannāndṛṣṭapṛṣṭhānarātinā | icchatīśaścyutācārāndārāniva nigopitum ||,"This, you should understand, is the cowardice that has been made manifest before you, as if one who desires to conceal his own unworthy conduct and misdeeds."
587.0,nanu ho manthanā rāgho ghorā nāthamaho nu na | tayadātavadā bhīmā mābhīdā bata dāyata ||,"Is it not surprising that the fierce Rāgha, who stirs , is not the Lord, although he seems formidable and powerful ? Indeed, the one known as Tayadātava has become formidable , as if he were a second creator . Alas, he has given ."
588.0,kiṃ tyaktāpāstadevatvamānuṣyakaparigrahaiḥ | jvalitānyaguṇairgurvī sthitā tejasi mānitā ||,"What indeed is this renunciation of godhood, accepted by human appropriation, that stands out, radiating with its own distinguished qualities, established in brilliance, and recognized?"
589.0,niśitāsirato'bhīko nyejate'maraṇā rucā | sārato na virodhī naḥ svābhāso bharavānuta ||,"Designated to be honored at sunset is the one who is invincible, not hostile to us, not opposed to our own radiance, heavily laden with offerings, and arises from the sharpened sense of commitment."
590.0,tanuvārabhaso bhāsvānadhīro'vinatorasā | cāruṇā ramate janye ko'bhīto rasitāśini ||,"With a slender waist and radiant, unwavering and not easily agitated, who is the one who, endowed with charm, delights the mind as praise is being bestowed upon him?"
591.0,vibhinne pātitāśvīyaniruddharathavartmani | hatadvipanagaṣṭyūtarudhirāmbunadākule ||,"On the dispersed battlefield, the enemy’s elephants, chariots, and horses have been scattered, toppled; they are drenched in a mixture of blood and mud."
592.0,devākānini kāvāde vāhikāsvasvakāhi vā | kākārebhabhare kākā nisvabhavyavyabhasvani ||,"In the assembly of gods or of Gandharvas, or even among serpents, which crow, posed on a tree, is just about to lose its feathers, resembling the crow's sounds?"
593.0,pranṛttaśavavitrastaturagākṣiptasārathau | mārutāpūrṇatūṇīravikruṣṭahatasādini ||,"The charioteer and horses, having been agitated by the sound of the dance, are bellowing in the roar of the wind, filled with the tumultuous sound, as if they too are joining in the dance."
594.0,sasattvaratide nityaṃ sadarāmarṣanāśini | tvarādhikakasannāde ramakatvamakarṣati ||,"Ever steadfast, constantly free from anger and animosity, always serene, and promptly acting, one who is such, ever draws towards themselves the quality of being delightful."
595.0,āsure lokavitrāsavidhāyini mahāhave | yuṣmābhirunnatiṃ nītaṃ nirastamiha pauruṣam ||,"By you all, in this grand battle, the disturber of the enemy's delight has been uplifted and vanquished."
596.0,iti śāsati senānyāṃ gacchatastānanekadhā | niṣidhya hasatā kiṃcittasthe tatrāndhakāriṇā ||,"While commanding the troops in that location, they move about in multiple ways; some, suppressed through his stern expression, are kept under control by him, who wields blind darkness."
597.0,munīṣudahanātaptā~llajjayā nivivṛtsyataḥ | śivaḥ prahlādayāmāsa tānniṣedhahimāmbunā ||,"The beings, who were afflicted by fear and felt ashamed due to being reprimanded by the sage’s son, were consoled by Shiva’s encouraging words and the rain he sent."
598.0,dūnāste'ribalādūnā nirebhā bahu menire | bhītāḥ śitaśarābhītāḥ śaṃkaraṃ tatra śaṃkaram ||,"Having been terrified by both biped and quadruped enemies, they, as having been made fearful, see Shankara (Rudra) as their protector in that same place, who has cool weapons."
599.0,maheṣujaladhau śatrorvartamānā duruttare | prāpya pāramiveśānamāśaśvāsa patākinī ||,"Having reached the inaccessible domain of the ocean of enemies, the mighty archer in that situation breathes easier, as if having attained a supreme divine abode."
600.0,sa babhāra raṇāpetāṃ camūṃ paścādavasthitām | puraḥsūryādapāvṛttāṃ chāyāmiva mahātaruḥ ||,"He had supported the army positioned opposite in the battlefield from behind, like a mighty tree casting its shade in front."
601.0,muñcatīśe śarāñjiṣṇau pinākasvanapūritaḥ | dadhvāna dhvanayannāśāḥ sphuṭanniva dharādharaḥ ||,"Wielding the Pinaka and appearing as a powerful shooter of sharp arrows, He, who has been filled, moves about holding firmly to the earth, roaring loudly."
602.0,tadraṇā dadṛśurbhimaṃ citrasaṃsthā ivācalāḥ | vismayena tayoryuddhaṃ citrasaṃsthā ivācalāḥ ||,"Upon seeing that distinctive banner, they were struck with wonder, as if viewing a stable, marvelous stage setting. Similarly, their amazement was stirred by the very battle itself."
603.0,parimohayamāṇena śikṣālāghavalīlayā | jaiṣṇavī viśikhaśreṇī parijahre pinākinā ||,"Being captivated by the shower of teachings from the crest jewel of Jaiṣṇavas, who skillfully uses scriptural examples, she has been pierced by the arrow of his teachings."
604.0,avadyanpatriṇaḥ śaṃbhoḥ sāyakairavasāyakaiḥ | pāṇḍavaḥ paricakrāma śikṣayā raṇaśikṣayā ||,"Pandava, having completed his instruction, himself encircled with arrows, as designated by Shiva, the targets for battle training."
605.0,cāracuñcuścirārecī cañcaccīrarucā rucaḥ | cacāra ruciraścāru cārairācāracañcuraḥ ||,"Gliding smoothly, adorned with a constantly enchanting charm, and gracefully exhibiting beauty in every movement and conduct, such a person, admired for their attractiveness, moves about."
606.0,sphuratpiśaṅgamaurvīkaṃ dhunānaḥ sa bṛhaddhanuḥ | dhṛtolkānalayogena tulyamaṃśumatā babhau ||,"Resplendent with a partridge-like color, wielding a massive bow, and, through the combination of his radiant energy and arrow, resembling a fire column."
607.0,pārthabāṇāḥ paśupaterāvavrurviśikhāvalīm | payomuca ivārandhrāḥ sāvitrīmaṃśusaṃhatim ||,"Arjuna's arrows, as if in a united line, rained down on Shiva, resembling streams of water from clouds; like the rays of the sun and moon, they formed such a line."
608.0,śaravṛṣṭiṃ vidhūyorvīmudastāṃ savyasācinā | rurodha mārgaṇairmārgaṃ tapanasya trilocanaḥ ||,"Having discarded the shower of arrows, wielding his favorite weapon, the three-eyed one emphatically declared, ""I have discovered the path!"""
609.0,tena vyātenire bhīmā bhīmārjanaphalānanāḥ | na nānukampya viśikhāḥ śikhādharajavāsasaḥ ||,"With that , being thoroughly agitated , the crests of the one known as Bhīma , who has faces like the remover of fear , should not be pitied , even though he wears a deer skin ."
610.0,dyuviyadgāminī tārasaṃrāvavihataśrutiḥ | haimīṣumālā śuśubhe vidyutāmiva saṃhatiḥ ||,"Adorning the sky as a garland might adorn a person, the sound of the celestial realm, disrupted by the roar of thunder, shone like a collection of lightning bolts."
611.0,vilaṅghaya patriṇāṃ paṅktiṃ bhinnaḥ śivaśilīmukhaiḥ | jyāyo vīryamupāśritya na cakampe kapidhvajaḥ ||,"Having separated from the ranks of his enemies with a peaceful stance, relying solely on his valor, Kapidhvaja, who bears the monkey banner, never faltered."
612.0,jagatīśaraṇe yukto harikāntaḥ sudhāsitaḥ | dānavarṣī kṛtāśaṃso nāgarāja ivābabhau ||,"Having taken refuge in the lord of the world, and endowed with serenity like the nectar-filled heart of Hari, the Dānava ṛṣi was made manifest like a noble king."
613.0,viphalīkṛtayatnasya kṣatabāṇasya śaṃbhunā | gāṇḍīvadhanvanaḥ khebhyo niścakrāma hutāśanaḥ ||,"Having proven futile, Arjuna's efforts, along with his sharp-shooting skills, were abandoned by Indra's weapon, ""Śambhunā,"" as it departed into the sky."
614.0,sa piśaṅgajaṭāvaliḥ kirannurutejaḥ parameṇa manyunā | jvalitauṣadhijātavedasā himaśailena samaṃ vididyute ||,"He, his tawny hair coiled in a snake-like hood, is celebrated for shining like a thousand suns, having blazed up like a plant-born fire, equaling the brilliance of lightning, and shining as resplendent as the summit of Himavat."
