id,sloka,translation
334, drākṣāṃ madhūkaṃ kharjūraṃ vidārīṃ saśatāvarīm|  parūṣakāṇi triphalāṃ sādhayetpalasammitam||123||  jalāḍhake pādaśeṣe rasamāmalakasya ca|  ghṛtamikṣurasaṃ kṣīramabhayākalkapādikam||124||  sādhayettadghṛtaṃ siddhaṃ śarkarākṣaudrapādikam|  prayogāt pittagulmaghnaṃ sarvapittavikāranut||125||  iti drākṣādyaṃ ghṛtam  ,"Having uttered the invocation to the Maruts, with the sacrificial offering placed before the patron deities, after establishing the recitation, [the text] says in a clear voice, ""O flag of the monkey, Kapi-dhvaja."" This is the preparation of the ghee made from grapes, madhūka, kharjūra, vidārī, saśatāvarī, triphala, mixed with the juice of pala, jalāḍhaka, pādaśeṣa, rasamāmala, kshaudra, kṣīra, abhaya, akalakapādi. This ghee, when prepared, becomes capable of pacifying all pitta-vikāra, as stated in the subsequent verse."
335, vṛṣaṃ samūlamāpothya pacedaṣṭaguṇe jale|  śeṣe'ṣṭabhāge tasyaiva puṣpakalkaṃ pradāpayet||126||  tena siddhaṃ ghṛtaṃ śītaṃ sakṣaudraṃ pittagulmanut|  raktapittajvaraśvāsakāsahṛdroganāśanam||127||  iti vāsāghṛtam  ,"The churned butter, made agreeable, invigorating, and superior, should be offered in the remaining eighth portion of it [the milk] that is full of the detached desire for success. Such ghee is cooling, having the qualities of cloud and water, curative of fever, wind, bile, and phlegm, and destructive of all diseases related to raktapitta, jvara, shwasa, kasa, and hridroga. This is called vasaghrtam."
336, dvipalaṃ trāyamāṇāyā jaladviprasthasādhitam|  aṣṭabhāgasthitaṃ pūtaṃ koṣṇaṃ kṣīrasamaṃ pibet||128||  pibedupari tasyoṣṇaṃ kṣīrameva yathābalam|  tena nirhṛtadoṣasya gulmaḥ śāmyati paittikaḥ||129||  ,"In the dispensing of justice that is impartial, as one who is not swayed by that which has been determined, for others whose āmnāya (traditional spiritual texts) is being protected, when one drinks, (he should drink) the properly prepared, pure, slightly warm, milk that is like cow's milk in the measure of one's capacity. Similarly, one should drink the heat of that (milk) in accordance with one's capacity. Through this, the undesirable accumulation of paittika (flatulence) subsides in one who is free from defects."
337, drākṣābhayārasaṃ gulme paittike saguḍaṃ pibet|  lihyātkampillakaṃ vā'pi virekārthaṃ madhudravam||130||  ,"In the wine made from drākṣā grapes, or in that of paittika preparation, one may partake of sagudaka quantity, or even that of kampillaka, for the purpose of appeasing hunger and thirst, as well as to attain a tranquil mind, similar to the serenity of a sage, during such austere times of scarcity."
338, dāhapraśamano'bhyaṅgaḥ sarpiṣā pittagulminām|  candanādyena tailena tailena madhukasya vā||131||   ,"Let this compound, endowed with such qualities and having obtained the opportunity, cause the appeasement of heat by anointing with a mixture of ghee and medicinal powders, or with sandalwood paste and sesame oil. Who would not delight in such speech by one who speaks thus?"
339, ye ca pittajvaraharāḥ  satiktāḥ kṣīrabastayaḥ|  hitāste pittagulmibhyo vakṣyante ye ca siddhiṣu||132||   ,"""Oh father, who has been informed, haven't those two always been guided by you, who are skilled in removing Pitta-fever, tranquil, and reside in the Kshiri abode? They are also beneficial for overcoming Pitta-dosha and are adept in achieving successes.""

The verb 'icchasi' in present tense indicates the speaker's curiosity towards the father about those two individuals, while other verbs in past or passive forms suggest completed actions related to their qualities and residence."
340, śālayo jāṅgalaṃ māṃsaṃ gavyāje payasī ghṛtam|  kharjūrāmalakaṃ drākṣāṃ dāḍimaṃ saparūṣakam||133||  āhārārthaṃ prayoktavyaṃ pānārthaṃ salilaṃ śṛtam|  balāvidārīgandhādyaiḥ pittagulmacikitsitam||134||  ,"Even the teacher of grammar, who is ignorant of the context of compound words, regards them as devoid of meaning, like a sacrificial offering made without intention. But, such a conception is incorrect. For instance, in the saying ""salilaṃ śṛtam"" (water is drunk), ""salila"" is in the accusative case, indicating it as the object of the verb ""drinking"". Similarly, in ""ghṛtam gavyāje payasī"" (ghee in a cow's milk), ""gavyāje"" modifies ""payasī"" (milk), indicating it as coming from a cow. Hence, one should understand the meaning of compound words in context, taking into account their grammatical function and meaning."
341, āmānvaye pittagulme sāme vā kaphavātike|  yavāgūbhiḥ khaḍairyūṣaiḥ sandhukṣyo'gnirvilaṅghite||135||   ,"Even in this regard, oh father, am I not the dispenser of the ultimate benefit? These, your two, are not established in the sphere of ether that is manifest in the sky, nor in the fiery brilliance of the stars, just as the opposite is not the case."
342, śamaprakopau doṣāṇāṃ sarveṣāmagnisaṃśritau|  tasmādagniṃ sadā rakṣennidānāni ca varjayet||136||   ,"As a Kshatriya, I, Dhanañjaya, son of Pandu, have been established in the designated duty of protecting. Therefore, I should always protect the fire and avoid accepting gifts that come from the shares due to my elder brother in his dominion."
343, vamanaṃ vamanārhāya pradadyāt kaphagulmine|   ,"Kṛṣṇadvaipāyana, named Vyāsa, should bestow this type of vow, to be performed extensively in the worship of the Lord of Wind, with great effort."
344, snigdhasvinnaśarīrāya gulme śaithilyamāgate||137||  pariveṣṭya pradīptāṃstu balvajānathavā kuśān|  bhiṣakkumbhe samāvāpya gulmaṃ ghaṭamukhe nyaset||138||  saṅgṛhīto  yadā gulmastadā ghaṭamathoddharet|  vastrāntaraṃ tataḥ kṛtvā bhindyādgulmaṃ  pramāṇavit||139||  vimārgājapadādarśairyathālābhaṃ prapīḍayet|  mṛdnīyādgulmamevaikaṃ na tvantrahṛdayaṃ  spṛśet||140||   ,"Under the king's sovereignty, which is unwavering and like a second self, we have been led, it seems, in this manner. Such a fate for wives like us, will surely come to pass."
345, tilairaṇḍātasībījasarṣapaiḥ parilipya ca|    śleṣmagulmamayaḥpātraiḥ sukhoṣṇaiḥ svedayedbhiṣak||141||    ,"With that ally Draupadi, together with"
346, savyoṣakṣāralavaṇaṃ daśamūlīśṛtaṃ ghṛtam|  kaphagulmaṃ jayatyāśu sahiṅgubiḍadāḍimam||142||  iti daśamūlīghṛtam|             ,"""The ghee, extracted from the dasamula, that has come to the assembly, has been smeared, applied, and divided by the one who is skilled. It has been made to flow and is now in front of us, addressed by the unfailing ones. Such is the dasamula ghee."""
347, bhallātakānāṃ dvipalaṃ pañcamūlaṃ palonmitam|  sādhyaṃ vidārīgandhādyamāpothya salilāḍhake||143||  pādaśeṣe rase tasmin pippalīṃ nāgaraṃ vacām|  viḍaṅgaṃ saindhavaṃ hiṅgu yāvaśūkaṃ biḍaṃ śaṭīm||144||  citrakaṃ madhukaṃ rāsnāṃ piṣṭvā karṣasamaṃ bhiṣak|  prasthaṃ ca payaso dattvā ghṛtaprasthaṃ vipācayet||145||  etadbhallātakaghṛtaṃ kaphagulmaharaṃ param|     plīhapāṇḍvāmayaśvāsagrahaṇīrogakāsanut||146||  iti bhallātakādyaṃ ghṛtam  ,Prescribe the following to be combined in a mixture:
348, pippalīpippalīmūlacavyacitrakanāgaraiḥ|  palikaiḥ sayavakṣārairghṛtaprasthaṃ vipācayet||147||  kṣīraprasthaṃ ca tat sarpihanti gulmaṃ kaphātmakam|  grahaṇīpāṇḍurogaghnaṃ plīhakāsajvarāpaham||148||  iti kṣīraṣaṭpalakaṃ ghṛtam  ,"They sprinkle it on a pippali plant, among others, for a moment,
enveloped in smoke from the burning of sacred herbs,
and cook it together with ghee and rice.
This preparation, made with milk from six palasha plants,
is called kshirashtaka, which alleviates phlegm-related disorders,
destroys graying hair, eliminates poison, and cures leprosy."
349, trivṛtāṃ triphalāṃ dantīṃ daśamūlaṃ palonmitam|  jale caturguṇe paktvā caturbhāgasthitaṃ rasam||149||  sarpireraṇḍajaṃ tailaṃ kṣīraṃ caikatra sādhayet|  sa siddho miśrakasnehaḥ sakṣaudraḥ kaphagulmanut||150||  kaphavātavibandheṣu kuṣṭhaplīhodareṣu ca|  prayojyo miśrakaḥ sneho yoniśūleṣu cādhikam||151||  iti miśrakaḥ snehaḥ  ,"With medicinal powders like triphala and dantika, and decoctions from dasamula, when cooked in water four times, becomes a mixture of oils, including sarpireraṇḍaja, taila, and kṣīra. This mixture, when used as a remedy, can cure ailments caused by an imbalance of kapha, vāta, and pitta in the body, as well as gynecological issues. This is known as the medicinal ointment."
350, yaduktaṃ vātagulmaghnaṃ sraṃsanaṃ nīlinīghṛtam|  dviguṇaṃ tadvirekārthaṃ prayojyaṃ kaphagulminām||152||  sudhākṣīradrave cūrṇaṃ trivṛtāyāḥ subhāvitam|  kārṣikaṃ madhusarpibhyāṃ līḍhvā  sādhu viricyate||153||  ,"The obstructor of winds and rain, being very dear, easily approachable, and superior to others, is worthy of being used twofold for the purification of phlegm and bile. The finely ground powder of sulabha, which is more excellent than others, is made sacred when mixed with the kshaara of madhusarka."
351, jaladroṇe vipaktavyā viṃśatiḥ pañca cābhayāḥ|  dantyāḥ palāni tāvanti citrakasya tathaiva ca||154|| aṣṭabhāgāvaśeṣaṃ tu rasaṃ pūtamadhikṣipet|  dantīsamaṃ guḍaṃ pūtaṃ kṣipettatrābhayāśca tāḥ||155||  tailārdhakuḍavaṃ caiva trivṛtāyāścatuṣpalam|  cūrṇitaṃ palamekaṃ  tu pippalīviśvabheṣajam||156||  tat sādhyaṃ lehavacchīte tasmiṃstailasamaṃ madhu|  kṣipeccūrṇapalaṃ caikaṃ tvagelāpatrakeśarāt||157||  tato lehapalaṃ līḍhvā jagdhvā caikāṃ harītakīm|  sukhaṃ viricyate snigdho doṣaprasthamanāmayam||158||  gulmaṃ śvayathumarśāṃsi pāṇḍurogamarocakam|  hṛdrogaṃ grahaṇīdoṣaṃ kāmalāṃ viṣamajvaram||159||  kuṣṭhaṃ plīhānamānāhameṣā hanyupasevitā|  niratyayaḥ kramaścāsyā dravo māṃsarasaudanaḥ||160||  iti dantīharītakī  ,"Prepare a concoction with twenty-five ingredients, free from impurities, including water from pure sources, plants mentioned in Citraka's group, and a portion of residual juice that is eight parts out of ten. Add pure jaggery, equal amounts of sugar candy, sesame oil, one unit of pippalī, and visha bheshaja. Mix this in a freshly made lehva, adding honey, a bit of well-ground pala, and haridra, then mix in haritaki, which has been soaked and then squeezed, to make a smooth, therapeutic, and wholesome paste. This concoction, when regularly consumed, will eliminate diseases such as gulma, shwasha, marsha, pandu, hridroga, grahani, kamala, visamajwara, kushtha, plihanam, arsha, and mamsarasa audana, leading to a disease-free state."
352, siddhāḥ siddhiṣu vakṣyante nirūhāḥ kaphagulminām|  ariṣṭayogāḥ siddhāśca grahaṇyarśaścikitsite||161||   ,"With the Dhartarashtras, together comes pleasure in enmity towards us, while they speak of successes, treating fault as if it were a relative, like a clan's shadow being served. Indeed, successes come to them in the form of astrological conjunctions and rituals, as well as through treatment of ailments."
353, yaccūrṇaṃ guṭikā yāśca vihitā vātagulminām|  dviguṇakṣārahiṅgvamlavetasāstāḥ kaphe hitāḥ||162||   ,"""Of pills, those that are free from defects, prescribed, made from two-syllable ingredients, not processed, and harmful to the nature of fearful individuals - they are beneficial for kapha."""
354, ya eva grahaṇīdoṣe kṣārāste kaphagulminām|  siddhā niratyayāḥ śastā dāhastvante praśasyate||163||   ,"If the heart, affected by the fault of grasping, is quickly overcome by phlegm, and if it does not cause a remedy to be sought, it will be praised as being skillfully destroyed."
355, prapurāṇāni dhānyāni jāṅgalā mṛgapakṣiṇaḥ|  kaulattho mudgayūṣaśca pippalyā nāgarasya ca||164||  śuṣkamūlakayūṣaśca bilvasya varuṇasya  ca|  cirabilvāṅkurāṇāṃ ca yavānyāścitrakasya ca||165||   ,"Previously gathered grains by forest-dwellers, using snares and traps, have been made equal in value through the activities of hares and deer. What could be more wonderful than this, that even the dwellers live together? Furthermore, the roots of kusha, mudgava, pippali, naga, shushkamoolaka, bilva, varuna, cira, bilvaankura, yava, and ashvattha have also become equal in value."
356, bījapūrakahiṅgvamlavetasakṣāradāḍimaiḥ|  takreṇa tailasarpirbhyāṃ vyañjanānyupakalpayet||166||    ,"The power of the subtle essence of the seed, combined with the qualities of being unsullied, free from decay, and born of noble parentage, should be considered as the essential attribute of the blade of grass; likewise, other indicators should be similarly determined using the juice and husk of the seed."
357, pañcamūlīśṛtaṃ toyaṃ purāṇaṃ vāruṇīrasam|  kaphagulmī pibetkāle jīrṇaṃ mādhvīkameva vā||167||   ,"Observe well the fifth root of the plant, from which water, in ancient times, was drawn that was similar to Varuni (the goddess of wine). One should drink it when it becomes kapha-inducing or even pungent, rather than preferring the superior taste of what is brought by others."
358, yavānīcūrṇitaṃ takraṃ biḍena lavaṇīkṛtam|  pibet sandīpanaṃ vātakaphamūtrānulomanam ||168||   ,"Let this drink, made noble by curry powder and salinity, be sipped as an invigorating, wind-stirred concoction, as long as steadfast fame endures for that man, the revered deva-stava Purusha."
359, sañcitaḥ kramaśo gulmo mahāvāstuparigrahaḥ|  kṛtamūlaḥ sirānaddho yadā kūrma ivonnataḥ||169||  daurbalyārucihṛllāsakāsavamyaratijvaraiḥ  |  tṛṣṇātandrāpratiśyāyairyujyate na sa sidhyati||170||   ,"When a person, named after the tortoise, known for his good qualities, established before, has his subsequent accumulated moments similar to a raised finger, then he does not achieve success when afflicted by weakness, desire, laughter, thirst, sleep, fear, and fever."
360, gṛhītvā sajvaraśvāsaṃ vamyatīsārapīḍitam|  hṛnnābhihastapādeṣu śophaḥ karṣati gulminam||171||   ,"Even the supreme among the forests, harder to overcome and taller than others, abandons its firm hold on the water-filled elephant if it is easier to attain, due to the great majesty and irresistible allure of the elephant."
361, raudhirasya tu gulmasya garbhakālavyatikrame|  snigdhasvinnaśarīrāyai dadyāt snehavirecanam||172||   ,"The pious ones should cause the ghee offering to be poured with a steady hand to the Vasundhara's offspring, the golden-hued Indu-mandala, as well as for those whose fame is bright, in the course of the gestation period of the Gulma herb."
362, palāśakṣārapātre dve dve pātre tailasarpiṣoḥ|  gulmaśaithilyajananīṃ paktvā mātrāṃ prayojayet||173||   ,"Let the lump of butter, located on the leaf of a palm tree, be split one by one for the twice-born using a sharp object. Having cooked the clarified butter that has become soft due to the heat of a firewood, one should offer it in the ritual, using those appropriate for the arati."
363, prabhidyeta na yadyevaṃ dadyādyoniviśodhanam  |   kṣāreṇa yuktaṃ palalaṃ sudhākṣīreṇa vā punaḥ||174|| ābhyāṃ vā bhāvitān dadyādyonau kaṭukamatsyakān|  varāhamatsyapittābhyāṃ laktakān vā subhāvitān||175||  adhoharaiścordhvaharairbhāvitān vā samākṣikaiḥ|  kiṇvaṃ vā saguḍakṣāraṃ dadyādyoniviśodhanam||176||   ,"One should not easily desire the cleansing of the stomach, whether through sucking in air or swallowing substances such as a lump of earth, a piece of wood, or a hair; or through eating bitter fish, such as the shark and catfish, prepared with vinegar and the urine or dung of cows; or through consuming foods that are processed down below or above, or that are overly pungent; for this brings only temporary relief and is unstable, like all material things, and does not lead to the eternal, blissful destination of liberation in the spiritual world."
364, raktapittaharaṃ kṣāraṃ lehayenmadhusarpiṣā|  laśunaṃ madirāṃ tīkṣṇāṃ matsyāṃścāsyai pradāpayet||177||   ,"One wishing to step over muddy ground should use a mixture of lime, clarified butter, lemon, honey, and rock salt; as well as a concoction made from spicy, pungent, bitter, astringent, and sour substances, which has been prepared and is ready for use, as a salve for the sunburnt eyes of a woman."
365, bastiṃ sakṣīragomūtraṃ sakṣāraṃ dāśamūlikam|  adṛśyamāne rudhire dadyādgulmaprabhedanam||178||   ,"Even if there has been carelessness, one who always designates a dwelling place, urine, cow dung, and ashes as witnesses, should give up, if blood is not visible, the division of a hair as it has been ordained, and should cause others to do the same; do not you do otherwise."
366, pravartamāne rudhire dadyānmāṃsarasaudanam|  ghṛtatailena cābhyaṅgaṃ pānārthaṃ taruṇīṃ surām||179||   ,"Drawing Lakshmi, detached from the previous assembly, I think I can bring about the dissolution of the enemies' existence by lifting and severing it with a dash of ghee, and I consider this young shoot of an intoxicating drink to be a suitable offering for drinking purposes."
367, rudhire'tipravṛtte tu raktapittaharīḥ kriyāḥ|  kāryā vātarugārtāyāḥ sarvā vātaharīḥ punaḥ||180||     ,"Then, a person has departed, so long as his duties, which are destroyers of phlegm-related ailments and which should be performed in the case of both a cough and other wind-related afflictions, are being carried out by others using grass and the like as fuel for fire."
368, ghṛtatailāvasekāṃśca tittirīṃścaraṇāyudhān|  surāṃ samaṇḍāṃ pūrvaṃ ca pānamamlasya sarpiṣaḥ||181||  prayojayeduttaraṃ vā jīvanīyena sarpiṣā|  atipravṛtte rudhire satiktenānuvāsanam||182||    ,"""Tell me, how does a person, whose anger has been calmed, respond to enemies? Explain this to me. Indeed, such a person will offer clarified butter, among other things, as an oblation in the earlier fire ritual, or will use it as a life-sustaining food, especially during excessive bleeding, to counteract the loss of vitality."""
369, tatra ślokāḥ  snehaḥ svedaḥ sarpirbastiścūrṇāni bṛṃhaṇaṃ guḍikāḥ|  vamanavirekau mokṣaḥ kṣatajasya ca vātagulmavatām||183||  sarpiḥ satiktasiddhaṃ kṣīraṃ prasraṃsanaṃ nirūhāśca|  raktasya cāvasecanamāśvāsanasaṃśamanayogāḥ||184||  upanāhanaṃ saśastraṃ pakvasyābhyantaraprabhinnasya|  saṃśodhanasaṃśamane pittaprabhavasya gulmasya||185||  snehaḥ svedo bhedo laṅghanamullekhanaṃ virekaśca|  sarpirbastirguṭikāścūrṇamariṣṭāśca sakṣārāḥ||186||  gulmasyānte dāhaḥ kaphajasyāgre'panītaraktasya|  gulmasya raudhirasya kriyākramaḥ strībhavasyoktaḥ||187||  pathyānnapānasevā hetūnāṃ varjanaṃ yathāsvaṃ ca|  nityaṃ cāgnisamādhiḥ snigdhasya ca sarvakarmāṇi||188||  heturliṅgaṃ siddhiḥ kriyākramaḥ sādhyatā na yogāśca|  gulmacikitsitasaṅgraha etāvān vyāhṛto'gniveśasya||189||  ,"A person who has treated the body with care, as designated by the terms of description, has, through speech, established the various types of offspring as esteemed members of their respective communities; they have, through action, caused growth in their own body as well as in that of their spouse; they have, through knowledge, recognized and separated the useful from the non-useful elements in food; they have, through wisdom, understood the qualities of substances such as butter, curd, etc.; they have, through contemplation, determined the appropriate course of action for various ailments - such a person, endowed with all good qualities, is truly praiseworthy."
370, ityagniveśakṛte tantre carakapratisaṃskṛte cikitsitasthāne  gulmacikitsitaṃ nāma pañcamo'dhyāyaḥ||5||  ,"This, the fifth chapter named ""Gulma Treatment"" in the text ""Caraka"" on the rituals of fire-offering, which is endowed with abundant strength and praised by all, is indeed lauded by those who harbor no ill will toward it."
371, athātaḥ pramehacikitsitaṃ vyākhyāsyāmaḥ||1|| iti ha smāha bhagavānātreyaḥ||2||  ,"Now, we shall explain the treatment of pride in battle, as was desired by the lord of men, like a king striving to extract water from a source."
372, nirmohamānānuśayo nirāśaḥ punarvasurjñānatapoviśālaḥ|  kāle'gniveśāya sahetuliṅgānuvāca mehāñśamanaṃ ca teṣām||3||  ,"The controller of the lineage, who has been spoken of, similarly adopted the austere conduct of his ancestor, as a mark of respect when, under dire circumstances, his command was disregarded by those subject to his authority."
373, āsyāsukhaṃ svapnasukhaṃ dadhīni grāmyaudakānūparasāḥ payāṃsi|  navānnapānaṃ guḍavaikṛtaṃ ca pramehahetuḥ kaphakṛcca sarvam||4||  ,"How can the stage of life, traditionally followed in a proper sequence, be ignored, while the qualities described by the seers as enhancing righteousness are present? It is inappropriate to deviate from the ancient rules. Also, consuming newly fermented drinks, such as those made from sugarcane, can cause diabetes, which is caused by an imbalance in kapha."
374, medaśca māṃsaṃ ca śarīrajaṃ ca kledaṃ kapho bastigataṃ pradūṣya| karoti mehān samudīrṇamuṣṇaistāneva pittaṃ paridūṣya cāpi||5|| kṣīṇeṣu doṣeṣvavakṛṣya bastau dhātūn pramehānanilaḥ karoti|  doṣo hi bastiṃ samupetya mūtraṃ sandūṣya mehāñjanayedyathāsvam||6||  ,"""Swollen with fluids and adhering to flesh, skin, and bones, this female fluid (dhūḥ, iyam, rūḍhāḥ) rejects my independence (svātantryam). This one (iyam) causes my waste products (mehān) to be churned and mixed with feces (uṣṇaistān), and further, when the waste products become excessive, this fluid causes them to enter the evacuation system (basti). Indeed, when the waste products enter there, this fluid causes them to obstruct the evacuation of urine and feces, just as they naturally occur."""
375, sādhyāḥ kaphotthā daśa pittajāḥ ṣaṭ yāpyā na sādhyaḥ pavanāccatuṣkaḥ||  samakriyatvādviṣamakriyatvānmahātyayatvācca yathākramaṃ  te||7||  ,"The ten dasya diseases, as well as those caused by kapha and pitta, should be treated, but the four aggravated by vata should not be transgressed in order, according to their due sequence, along with the treatment of the root causes, as instructed by Manu."
376, kaphaḥ sapittaḥ pavanaśca doṣā medo'sraśukrāmbuvasālasīkāḥ|  majjā rasaujaḥ piśitaṃ ca dūṣyāḥ[1] pramehiṇāṃ viṃśatireva mehāḥ||8||  ,"""Even in the cleansed atmosphere, the phlegm, sap, bile, sweat, urine, feces, marrow, taste, oil, and dirt of the twenty-four physiological processes indeed taint the glorified ones."""
377, jalopamaṃ cekṣurasopamaṃ vā ghanaṃ ghanaṃ copari viprasannam|  śuklaṃ saśukraṃ śiśiraṃ śanairvā lāleva vā vālukayā yutaṃ vā||9||  vidyāt pramehān  kaphajān daśaitān kṣāropamaṃ kālamathāpi nīlam|  hāridramāñjiṣṭhamathāpi raktametān pramehān ṣaḍuśanti pittāt||10||  majjaujasā vā vasayā'nvitaṃ vā lasīkayā vā satataṃ vibaddham|  caturvidhaṃ mūtrayatīha[1] vātāccheṣeṣu dhātuṣvapakarṣiteṣu||11||  ,"""Having been described, it will be illuminated from all sides, taken by the hands, as if it were a divine form, brought forth, worshipped, and established by Maghavat (Indra). It has the properties of water, is similar to a mirror, dense, shining, clear, cool, or associated with white, red, or black excrement. It may constantly pervade the fatty tissue, be present in the four types of excretions, or be extracted from the bodily humors."""
378, varṇaṃ rasaṃ sparśamathāpi gandhaṃ yathāsvadoṣaṃ bhajate pramehaḥ|  śyāvāruṇo vātakṛtaḥ saśūlo majjādisādguṇyamupaityasādhyaḥ||12||  ,"""Pleased by me, Pinākinī, together with the guardians of the three worlds, has previously partaken in rites that are unfailingly prescribed, just as one enjoys color, taste, touch, scent, and purity, without flaw, and vigorously rouses Lakṣmī in others. Through that, it has become hidden."""
379, svedo'ṅgagandhaḥ śithilāṅgatā ca śayyāsanasvapnasukhe ratiśca|  hṛnnetrajihvāśravaṇopadeho ghanāṅgatā keśanakhātivṛddhiḥ||13|| śītapriyatvaṃ galatāluśoṣo mādhuryamāsye karapādadāhaḥ|  bhaviṣyato mehagadasya rūpaṃ mūtre'bhidhāvanti pipīlikāśca||14||  ,"""Empowered by Vasava's words, Dhananjaya adorned his radiant face and spotless eyes, bestowing upon them grace. He performed austerities and offered sacrifices."""
